,uuid,creditCode,regNo,orgCodes,entStatus,regCap,frName,industryPhyName,esDate,opFrom,opTo,regOrgProvince,regOrg,entType,entName,dom,opScope,approvedTime,phoneNumber,email,oldName,validTime,industryLargeName,industryMiddleName,county,industryType,createTime,updateTime,isDeleted,state,city,website
0,ef04726a-d834-11e9-80c9-fa163e3115c2,913702002645941215,370205228025417,264594121,在营（开业）企业,4005.000000万,丁香鹏,制造业,1994-12-13,1994-12-13,,山东省,青岛市市场监督管理局,股份有限公司(非上市、自然人投资或控股),青岛国林环保科技股份有限公司,青岛市市北区瑞昌路168号,生产：消毒器械（臭氧发生器）（消毒产品生产企业卫生许可证有效期限以许可证为准）。臭氧技术产品研究、开发、生产；工业管道GC2安装；高低压成套电气设备的制造、销售；D1、D2类低、中压容器设计、制造；工业气体分离与净化技术研发、制造、销售、技术服务；机电一体化电子产品开发、生产；电子功能陶瓷产品研究、开发、生产、销售；晶体乙醛酸一水合物的生产、销售；环保工程设计、安装、施工；货物及技术进出口；批发、零售：金属材料（不含稀贵金属）、五金交电、化工产品（不含危险品）、环保设备（公司住所仅限办公）。（依法须经批准的项目，经相关部门批准后方可开展经营活动）。（依法须经批准的项目，经相关部门批准后方可开展经营活动）,2019-04-08,0532-84992167,office@china-guolin.com,青岛国林实业股份有限公司,长期,专用设备制造业,医疗仪器设备及器械制造,市北区,大健康,2019-09-16 11:49:07,2019-09-16 11:49:07,0,1,青岛市,http://www.china-guolin.com
1,92a1a58b-d83f-11e9-80c9-fa163e3115c2,9111000079598548XH,110113001479889,79598548X,开业,40000.000000万人民币,申东日,批发和零售业,2006-11-09,2006-11-09,,北京市,北京市工商行政管理局顺义分局,股份有限公司(上市、自然人投资或控股),朗姿股份有限公司,北京市顺义区马坡镇白马路63号,生产服装；销售服装、日用品、鞋帽箱包、五金、婴幼儿用品、化妆品、玩具、皮革制品；货物进出口；技术进出口；代理进出口；承办展览展示活动；仓储服务；技术服务。（企业依法自主选择经营项目，开展经营活动；依法须经批准的项目，经相关部门批准后依批准的内容开展经营活动；不得从事本市产业政策禁止和限制类项目的经营活动。）,2017-06-30,53518800,无,"北京朗姿服装实业有限公司,北京申诚信和服装有限公司",长期,批发业,纺织、服装及家庭用品批发,顺义区,大健康,2019-09-16 13:05:17,2019-09-16 13:05:17,0,1,北京市,http://langzi.tmall.com
2,6accc9ba-4bc2-11e9-a8b1-fa163e5275a2,91350200612261252T,350200200013196,612261252,存续（在营、开业、在册）,15054.000000万人民币,林瑞梅,制造业,1994-12-07,1994-12-07,9999-12-31,福建省,厦门市市场监督管理局,其他股份有限公司(上市),厦门光莆电子股份有限公司,厦门市思明区岭兜西路608号,机器人及智能设备的设计、研发、制造及销售（不含须经许可审批的项目）；电光源制造；照明灯具制造；灯用电器附件及其他照明器具制造；半导体分立器件制造；光电子器件及其他电子器件制造；软件开发；信息系统集成服务；其他未列明信息技术服务业（不含需经许可审批的项目）；机械治疗及病房护理设备制造；其他电子设备制造；互联网销售；第一类医疗器械批发；第二类医疗器械批发；第三类医疗器械批发；建筑装饰业；自有房地产经营活动；经营本企业自产产品的出口业务和本企业所需的机械设备、零配件、原辅材料的进口业务（不另附进出口商品目录），但国家限定公司经营或禁止进出口的商品及技术除外。,2018-09-10,6022013,无,,长期,计算机、通信和其他电子设备制造业,电子元件制造,思明区,大健康,2019-03-21 18:16:40,2019-03-21 18:16:40,0,0,厦门市,https://mall.jd.com/index-1000072606.html
3,9306fd65-d83f-11e9-80c9-fa163e3115c2,91430000745928604G,430000000001637,745928604,存续（在营、开业、在册）,309839.419200万人民币,陈邦,卫生和社会工作,2003-01-24,2003-01-24,,湖南省,湖南省市场监督管理局,股份有限公司(上市、自然人投资或控股),爱尔眼科医院集团股份有限公司,长沙市芙蓉区长冲路99号隆平高科技园省科研成果转化中心一楼,眼科医院的投资和医院经营管理服务（不得从事吸收存款、集资收款、受托贷款、发行票据、发放贷款等国家金融监管及财政信用业务）；眼科医疗技术的研究，远程医疗软件的研发、生产、销售；眼科、内科、麻醉科、检验科、影视像科、验光配镜。（依法须经批准的项目，经相关部门批准后方可开展经营活动）,2019-07-22,0731-85179288,无,,长期,卫生,医院,芙蓉区,大健康,2019-09-16 13:05:17,2019-09-16 13:05:17,0,1,长沙市,aierchina.com
4,9356eff3-d83f-11e9-80c9-fa163e3115c2,91441900708014002M,441900000178999,708014002,在营（开业）,54585.426400,王蔚,其他农业,1998-08-06,1998-08-06,长期,广东省,广东省东莞市工商行政管理局,股份有限公司(上市、自然人投资或控股),盈康生命科技股份有限公司,东莞市塘厦镇蛟坪大道83号,医疗器械的研发和经营；医疗行业投资；对外投资；股权投资；货物及技术进出口；为成员企业及关联企业提供经营决策和企业管理咨询、财务管理咨询、资本经营管理和咨询。(依法须经批准的项目，经相关部门批准后方可开展经营活动)〓,2019-08-07,7722382,,,长期,,,,大健康,2019-09-16 13:05:18,2019-09-16 13:05:18,0,1,东莞市,
5,93a5e74e-d83f-11e9-80c9-fa163e3115c2,911100007000084768,110000410140103,700008476,开业,178165.292100万人民币,蒲忠杰,制造业,1999-06-11,1999-06-11,2057-06-10,北京市,北京市工商行政管理局昌平分局,股份有限公司(中外合资、上市),乐普（北京）医疗器械股份有限公司,北京市昌平区超前路37号,生产、销售医疗器械及其配件；医疗器械及其配件的技术开发；提供自产产品的技术咨询服务；上述产品的进出口；技术进出口；佣金代理（不含拍卖、涉及配额许可证管理、专项规定管理的商品按国家有关规定办理）。（依法须经批准的项目，经相关部门批准后依批准的内容开展经营活动。）,2019-05-15,80120666,office_lepu@lepumedical.com,,2057-06-10,专用设备制造业,医疗仪器设备及器械制造,昌平区,大健康,2019-09-16 13:05:18,2019-09-16 13:05:18,0,1,北京市,http://www.lepumedical.com
6,93f42530-d83f-11e9-80c9-fa163e3115c2,913201006089812733,320100400012542,608981273,存续（在营、开业、在册）,10000.000000万人民币,隆晓辉,制造业,2000-05-10,2000-05-10,,江苏省,南京市市场监督管理局,股份有限公司(中外合资、未上市),南京微创医学科技股份有限公司,南京高新开发区高科三路10号,医疗器械的研发、生产与销售（凭许可证所列事项生产经营）；与本企业业务相关的产品及技术的进出口业务（不涉及国营贸易管理商品，涉及配额、许可证管理商品的，按国家有关规定办理申请）；消毒灭菌服务；企业管理咨询服务；自有房屋及设备租赁；网上销售医疗器械。（依法须经批准的项目，经相关部门批准后方可开展经营活动）,2019-03-20,025-58646365,mjj@micro-tech.com.cn,南京微创医学科技有限公司,长期,专用设备制造业,医疗仪器设备及器械制造,,大健康,2019-09-16 13:05:19,2019-09-16 13:05:19,0,1,南京市,www.micro-tech.com.cn
7,9468ad54-d83f-11e9-80c9-fa163e3115c2,913502007617290664,350205200008366,761729066,存续（在营、开业、在册）,40193.000000万人民币,林志雄,制造业,2004-08-12,2004-08-12,,福建省,厦门市市场监督管理局,股份有限公司(台港澳与境内合资、上市),大博医疗科技股份有限公司,厦门市海沧区山边洪东路18号,研发生产二类6826物理治疗设备、二类6865医用缝合材料和三类6810矫形外科（骨科）手术器械；二类6810矫形外科（骨科）手术器械、三类6846植入材料；一类医疗器械的研发、生产；骨科植入材料模具的制造；批发和进出口：三类、二类：注射穿刺器械、医用电子仪器设备、医用光学器具仪器及内窥镜设备、医用超声仪器及有关设备、物理治疗及康复设备、临床检验分析仪器（体外诊断试剂除外）、植入材料和人工器官、手术室急救室诊疗室设备及器具、口腔科材料、医用卫生材料及敷料、医用缝合材料及粘合剂；三类、二类：医用高分子材料及制品；二类：手术器械、普通诊察器械、中医器械、口腔科设备及器具、病房护理设备及器具、消毒和灭菌设备及器具。,2019-03-01,6087672,无,,长期,专用设备制造业,医疗仪器设备及器械制造,海沧区,大健康,2019-09-16 13:05:20,2019-09-16 13:05:20,0,1,厦门市,http://www.double-medical.com/
8,94b5c121-d83f-11e9-80c9-fa163e3115c2,913101150512565326,,051256532,存续（在营、开业、在册）,5397.814700万人民币,彭博,批发和零售业,2012-08-17,2012-08-17,,上海市,上海市市场监督管理局,股份有限公司(台港澳与境内合资、未上市),上海微创心脉医疗科技股份有限公司,上海市浦东新区康新公路3399弄1号,生产Ⅲ类6846支架、Ⅲ类6877血管内导管，销售自产产品；研发主动脉、外周血管介入治疗医疗器械，转让自研技术，并提供相关技术服务、技术咨询；从事医疗器械（Ⅰ类、Ⅱ类、Ⅲ类）的批发、进出口、佣金代理（拍卖除外），并提供相关配套服务（不涉及国营贸易管理，涉及配额、许可证管理商品的，按国家有关规定办理申请）。【依法须经批准的项目，经相关部门批准后方可开展经营活动】,2012-08-17,021-38954600,xhzhu@microport.com,微创心脉医疗科技（上海）有限公司,长期,批发业,医药及医疗器材批发,浦东新区,大健康,2019-09-16 13:05:20,2019-09-16 13:05:20,0,1,上海市,www.endovastec.com
9,950d1022-d83f-11e9-80c9-fa163e3115c2,91440101759431420M,440126400010558,759431420,在营（开业）企业,20000.000000万人民币,韩广源,制造业,2004-04-30,2004-04-30,,广东省,广州市市场监督管理局,股份有限公司(台港澳与境内合资、上市),广州维力医疗器械股份有限公司,广州市番禺区化龙镇金湖工业城C区4号,医疗卫生用塑料制品制造;非许可类医疗器械经营（即不需申请《医疗器械经营企业许可证》即可经营的医疗器械”，包括第一类医疗器械和国家规定不需申请《医疗器械经营企业许可证》即可经营的第二类医疗器械）;医疗用品及器材零售（不含药品及医疗器械）;假肢、人工器官及植（介）入器械制造;医疗诊断、监护及治疗设备制造;机械治疗及病房护理设备制造;医疗、外科及兽医用器械制造;口腔科用设备及器具制造;医疗实验室设备和器具制造;外科、牙科等医疗专用设备及器械制造;医用消毒设备和器具制造;医疗诊断、监护及治疗设备批发;许可类医疗器械经营（即申请《医疗器械经营企业许可证》才可经营的医疗器械”，包括第三类医疗器械和需申请《医疗器械经营企业许可证》方可经营的第二类医疗器械）;医疗诊断、监护及治疗设备零售;,2018-07-26,020-84758878,chenmeiling@welllead.com.cn,,长期,专用设备制造业,医疗仪器设备及器械制造,番禺区,大健康,2019-09-16 13:05:21,2019-09-16 13:05:21,0,1,广州市,www.welllead.com.cn
10,955b5da2-d83f-11e9-80c9-fa163e3115c2,91110000101927796W,110000004631855,101927796,开业,292374.278200万人民币,王靖,科学研究和技术服务业,1995-12-02,2000-08-16,,北京市,北京市工商行政管理局海淀分局,其他股份有限公司(上市),北京信威科技集团股份有限公司,北京市海淀区东北旺西路8号中关村软件园7号楼一层,技术开发、技术推广、技术转让、技术咨询、技术服务；销售、租赁、安装及维修通讯设备、电子产品；计算机系统服务；货物进出口、技术进出、代理进出口。（企业依法自主选择经营项目，开展经营活动；依法须经批准的项目，经相关部门批准后依批准的内容开展经营活动；不得从事本市产业政策禁止和限制类项目的经营活动。）,2017-11-16,010-62802288,investor@xinwei.com.cn,"北京中创信测科技股份有限公司,北京信威通信科技集团股份有限公司",长期,科技推广和应用服务业,其他科技推广和应用服务业,海淀区,大健康,2019-09-16 13:05:21,2019-09-16 13:05:21,0,1,北京市,http://www.xinweigroup.com.cn/
11,694dc803-d850-11e9-80c9-fa163e3115c2,91310000734047094H,310000400110706,734047094,存续（在营、开业、在册）,34101.018200万人民币,海乐,租赁和商务服务业,1995-03-30,1995-03-30,,上海市,上海市市场监督管理局,其他股份有限公司(上市),运盛（上海）医疗科技股份有限公司,上海市青浦区赵巷镇沪青平公路2855弄1-72号A座2A层2A08号,从事医疗科技领域内的科技技术开发、技术咨询、技术服务、技术转让，医疗器械经营，投资咨询和投资管理，医疗行业计算机软硬件的技术开发、项目投资管理，实业投资管理，企业管理咨询。【依法须经批准的项目，经相关部门批准后方可开展经营活动】,1995-03-30,021-50720888,无,运盛（上海）实业股份有限公司,长期,商务服务业,企业管理服务,青浦区,大健康,2019-09-16 15:05:48,2019-09-16 15:05:48,0,1,上海市,http://www.winsan.cn/
12,960f5f7e-d83f-11e9-80c9-fa163e3115c2,9142058373914001XH,420500400000854,73914001X,存续（在营、开业、在册）,42217.693800万,崔金海,批发和零售业,2002-07-24,2002-07-24,,湖北省,宜昌市市场监督管理局,股份有限公司(上市、自然人投资或控股),奥美医疗用品股份有限公司,枝江市马家店七星大道18号,生产、销售、研发医用卫生材料、无纺布制品及其它医疗用品、卫生用品、体育用品、婴儿用品、纺织、服装；货物进出口贸易（不包括进口商品分销业务；国家限制公司经营或限制进出口的商品或技术除外）；机械设备租赁；房屋出租；商务信息咨询服务、会务会展服务(按许可证或批准文件核定内容经营，未取得相关有效许可或批准文件的，不得经营)###,2019-05-27,0717-4211420,2193591074@qq.com,枝江奥美医疗用品有限公司,长期,批发业,医药及医疗器材批发,枝江市,大健康,2019-09-16 13:05:22,2019-09-16 13:05:22,0,1,宜昌市,allmed-china.com
13,966daebb-d83f-11e9-80c9-fa163e3115c2,91330600609661634M,330600400002113,609661634,存续,14000.000000万人民币,鲁建国,制造业,1994-08-18,1994-08-18,9999-09-09,浙江省,浙江省市场监督管理局,股份有限公司(上市、自然人投资或控股),振德医疗用品股份有限公司,浙江省绍兴市越城区皋埠镇皋北工业区,生产、销售：第一类医疗器械、第二类医疗器械、第三类医疗器械、一次性使用卫生用品、日常防护用品、劳动保护用品、特殊劳动防护用品、消毒产品、化妆品、运动防护用品、体育用品；货物进出口。（依法须经批准的项目，经相关部门批准后方可开展经营活动）,2019-08-05,18658515989,jhp@zhende.com,绍兴振德医用敷料有限公司,长期,纺织业,针织或钩针编织物及其制品制造,越城区,大健康,2019-09-16 13:05:23,2019-09-16 13:05:23,0,1,绍兴市,http://www.zhende.com
14,96bfadaf-d83f-11e9-80c9-fa163e3115c2,91320400250815683R,320483000092759,250815683,存续（在营、开业、在册）,16900.000000万人民币,李平,制造业,1990-07-04,1990-07-04,,江苏省,常州市市场监督管理局,股份有限公司(上市),江苏南方卫材医药股份有限公司,江苏武进经济开发区果香路1号,二类6864医用卫生材料及敷料的制造；贴剂、贴膏剂的制造、中药提取；一类基础外科手术器械、物理治疗设备、手术室、急救室、诊疗室设备及器具、医用冷疗、低温、冷藏设备及器具、医用高分子材料及制品的制造、销售；织布；日用品、运动用品及运动护具的制造、销售；化妆品销售；自营和代理各类商品及技术的进出口业务（国家禁止或限制企业经营的商品和技术除外）。（依法须经批准的项目，经相关部门批准后方可开展经营活动）,2019-06-28,0519-86361050,info@nanfangmedical.com,,长期,专用设备制造业,医疗仪器设备及器械制造,,大健康,2019-09-16 13:05:24,2019-09-16 13:05:24,0,1,,www.nfmedical.com.cn
15,971b1f14-d83f-11e9-80c9-fa163e3115c2,91440300279534922P,440301103299533,279534922,存续（在营、开业、在册）,70591.791400万人民币,梁桂秋,制造业,1998-03-13,1998-03-13,2048-03-13,广东省,深圳市市场监督管理局,股份有限公司(上市),深圳市尚荣医疗股份有限公司,深圳市龙岗区宝龙工业城宝龙5路2号尚荣科技工业园1号厂房2楼,一般经营项目是：医疗设备及医疗系统工程、医疗设施的技术开发（不含限制项目）；净化及机电设备的安装；建筑材料、五金制品、机电产品、电子电器产品的购销及其他国内商业、物资供销业（不含专营、专控、专卖商品）；兴办实业（具体项目另行申报）；医疗器械销售（具体按许可证办理）；医疗器械设计、生产及销售；医疗器械、设备的租赁；进出口业务（具体按进出口资格证书经营）；建筑工程施工；建筑工程安装；建筑室内外装修装饰工程；市政公用工程的施工；地基与基础工程的施工；房屋建筑消防设施工程的施工；建筑劳务分包（取得建设行政主管部门的资质证书方可经营）；救护车生产和销售；投资建设医院。，许可经营项目是：,2019-06-20,0755-82290988,hr@glory-medical.com.cn,深圳市尚荣医疗设备有限公司,2048-03-13,专用设备制造业,医疗仪器设备及器械制造,龙岗区,大健康,2019-09-16 13:05:24,2019-09-16 13:05:24,0,1,深圳市,http://www.glory-medical.com.cn
16,29afa6e4-4bc1-11e9-a8b1-fa163e5275a2,91310000769685408G,310109000393135,769685408,存续（在营、开业、在册）,3120万人民币,夏其峰,信息传输、软件和信息技术服务业,2004-12-09,2004-12-09,,上海市,上海市工商行政管理局,股份有限公司（非上市、自然人投资或控股）,上海海典软件股份有限公司,中国（上海）自由贸易试验区金湘路345号2225室,计算机软硬件、网络技术、信息技术领域内的“四技”服务，第二类增值电信业务中的信息服务业务（不含固定网电话信息服务和互联网信息服务），计算机软硬件销售。【依法须经批准的项目，经相关部门批准后方可开展经营活动】,2004-12-09,021-50111521,fengjun1016@hydee.cn,上海海典软件有限公司,长期,软件和信息技术服务业,信息技术咨询服务,自由贸易试验区,大健康,2019-03-21 18:07:41,2019-03-21 18:07:41,0,0,,WWW.HYDEE.CN
17,9783e870-d83f-11e9-80c9-fa163e3115c2,9137020273728436XX,370202228063854,73728436X,在营（开业）企业,2189.782000万,赵兴庭,信息传输、软件和信息技术服务业,2002-05-23,2002-05-23,,山东省,青岛市市场监督管理局,其他股份有限公司(非上市),青岛雨诺网络信息股份有限公司,青岛市市南区宁夏路288号软件产业基地G3楼113室、115室,计算机软硬件开发及技术服务；数据库及网络技术开发、服务；批发、零售自有研发产品、计算机软硬件及配件、电子设备及耗材；企业管理咨询；营销策划；形象策划；市场调查；人才信息咨询服务（不含劳务中介咨询）；展览展示服务；设计、制作、代理、发布国内广告业务；批发、零售：Ⅰ、Ⅱ类医疗器械；网上销售药品、医疗器械；医疗器械租赁；办公设备租赁。（以上范围需经许可经营的，须凭许可证经营）。,2019-07-08,0532-85886309,romens@romens.cn,青岛雨人软件科技有限公司,长期,互联网和相关服务,互联网信息服务,市南区,大健康,2019-09-16 13:05:25,2019-09-16 13:05:25,0,1,青岛市,
18,97d9153e-d83f-11e9-80c9-fa163e3115c2,9133000025393934X6,,25393934X,存续,72831.262800万人民币,葛航,信息传输、软件和信息技术服务业,1997-12-10,1997-12-10,,浙江省,浙江省市场监督管理局,股份有限公司(上市、自然人投资或控股),创业慧康科技股份有限公司,浙江省杭州市滨江区长河街道越达巷92号创业智慧大厦五楼,物联网技术、数据处理技术、信息技术的技术开发、技术咨询、技术服务，经营增值电信业务（凭许可证经营），医疗器械生产（详见《医疗器械生产企业许可证》），医疗器械经营（限批发，范围详见《中华人民共和国医疗器械经营企业许可证》），电子计算机软件的技术开发、咨询及服务、成果转让，电子计算机的安装、维修，智能楼宇工程、电子与智能化工程、消防设施工程、机电安装工程、灯光工程、音响工程、舞台机械工程的设计、施工，电子计算机及配件的批发，经营进出口业务。（依法须经批准的项目，经相关部门批准后方可开展经营活动）,2019-08-01,0571-88217878,bsoft@bsoft.com.cn,创业软件股份有限公司,长期,软件和信息技术服务业,软件开发,滨江区,大健康,2019-09-16 13:05:25,2019-09-16 13:05:25,0,1,杭州市,http://www.bsoft.com.cn
19,982e7f9a-d83f-11e9-80c9-fa163e3115c2,91330000754441902G,330102000028950,754441902,存续,80788.533400万人民币,章笠中,批发和零售业,2003-11-21,2003-11-21,2033-11-19,浙江省,浙江省市场监督管理局,其他股份有限公司(上市),思创医惠科技股份有限公司,浙江省杭州市拱墅区莫干山路1418—25号（上城科技经济园）,塑胶产品、电子产品、五金产品的制造（凭许可证经营）。物联网技术开发、技术应用推广服务，信息系统集成，塑胶产品、电子产品、五金产品的开发及销售，货物进出口，商业、饮食、服务专用设备、社会公共安全设备及器材的制造，房屋、设备租赁，医疗技术、计算机软硬件的技术开发、技术咨询、技术服务，洗衣服务，纺织品、医疗器械、日用百货、消毒用品（不含药品）的销售。（依法须经批准的项目，经相关部门批准后方可开展经营活动）,2018-05-28,28975273,,杭州中瑞思创科技股份有限公司,2033-11-19,批发业,机械设备、五金产品及电子产品批发,拱墅区,大健康,2019-09-16 13:05:26,2019-09-16 13:05:26,0,1,杭州市,
20,8384bd74-4bbf-11e9-a8b1-fa163e5275a2,91350200612040492E,350298200002795,612040492,存续（在营、开业、在册）,43000.000000万人民币,张曦,信息传输、软件和信息技术服务业,2000-07-14,2000-07-14,2050-07-13,福建省,厦门市市场监督管理局,股份有限公司(上市、自然人投资或控股),易联众信息技术股份有限公司,厦门市软件园二期观日路18号502室,其他未列明信息技术服务业（不含需经许可审批的项目）(研发、设计和生产智能卡、银行卡；销售智能卡)；商务信息咨询；档案处理及档案电子化服务；第一类医疗器械批发；第一类医疗器械零售；第二类医疗器械批发；第二类医疗器械零售；第三类医疗器械批发；第三类医疗器械零售；医疗诊断、监护及治疗设备制造；其他医疗设备及器械制造(仅限其分支机构代为加工)；卫生材料及医药用品制造(仅限其分支机构代为加工)；互联网接入及相关服务（不含网吧）；软件开发；信息系统集成服务；信息技术咨询服务；数据处理和存储服务；集成电路设计；数字内容服务；其他机械设备及电子产品批发；呼叫中心（不含需经许可审批的项目）；新材料技术推广服务；其他未列明电信业务；计算机、软件及辅助设备批发；计算机、软件及辅助设备零售；通信设备零售；其他电子产品零售；节能技术推广服务；互联网销售；通讯及广播电视设备批发；对第一产业、第二产业、第三产业的投资（法律、法规另有规定除外）；投资管理（法律、法规另有规定除外）；资产管理（法律、法规另有规定除外）；投资咨询（法律、法规另有规定除外）；企业管理咨询；投资管理咨询（法律、法规另有规定除外）；经营各类商品和技术的进出口（不另附进出口商品目录），但国家限定公司经营或禁止进出口的商品及技术除外；互联网信息服务（不含药品信息服务和网吧）；包装装潢及其他印刷；装订及印刷相关服务。,2018-08-14,6307571,1757132245@qq.com,,2050-07-13,软件和信息技术服务业,信息系统集成服务,,大健康,2019-03-21 17:55:53,2019-03-21 17:55:53,0,0,厦门市,http://s3.ylzinfo.com:8085/
