,uuid,creditCode,regNo,orgCodes,entStatus,regCap,frName,industryPhyName,esDate,opFrom,opTo,regOrgProvince,regOrg,entType,entName,dom,opScope,approvedTime,phoneNumber,email,oldName,validTime,industryLargeName,industryMiddleName,county,industryType,createTime,updateTime,isDeleted,state,city,website
208,ca86b59f-d842-11e9-80c9-fa163e3115c2,91420000706963132M,420000000034415,706963132,存续（在营、开业、在册）,80962.399900万,曹龙祥,制造业,1997-01-22,1997-01-22,,湖北省,湖北省市场监督管理局,股份有限公司(上市),湖北济川药业股份有限公司,湖北省荆州市沙市区园林路时尚豪庭602室,药品研发；医药及其他领域投资管理；日化品销售；橡胶制品、塑料制品制造与销售；有色金属、五金交电、化工原料（不含危险品）、装潢材料批发、零售；科技及经济技术咨询服务（不含证券期货咨询）；自营和代理各类商品及技术的进出口业务（不含国家禁止或限制进出口的商品及技术）。,2016-06-07,0523-87606428,jtb@jumpcan.com,湖北洪城通用机械股份有限公司,长期,金属制品业,结构性金属制品制造,沙市区,大健康,2019-09-16 13:28:19,2019-09-16 13:28:19,0,1,荆州市,www.jumpcan.com
209,cae15993-d842-11e9-80c9-fa163e3115c2,91370000728611939A,371700400000462,728611939,在营（开业）企业,88634.000000万人民币,赵涛,制造业,2001-05-10,2001-05-10,,山东省,山东省市场监督管理局,股份有限公司(台港澳与境内合资、上市),山东步长制药股份有限公司,菏泽市中华西路369号,片剂、硬胶囊剂、颗粒剂、丸剂（蜜丸、浓缩丸、水丸、水蜜丸）、口服液。(依法须经批准的项目，经相关部门批准后方可开展经营活动，有效期以许可证为准),2018-12-06,0530-5299369,sdbczjb9369@126.com,,长期,医药制造业,中成药生产,,大健康,2019-09-16 13:28:19,2019-09-16 13:28:19,0,1,菏泽市,https://www.buchang.com
210,cb415bcd-d842-11e9-80c9-fa163e3115c2,91330000142924161N,330000000010348,142924161,存续,266732.020000万人民币,胡季强,制造业,1993-01-09,1993-01-09,,浙江省,浙江省工商行政管理局,其他股份有限公司(上市),浙江康恩贝制药股份有限公司,浙江省兰溪市康恩贝大道1号,药品生产（范围详见《中华人民共和国药品生产许可证》）。食品生产（范围详见《食品生产许可证》），卫生材料及敷料的制造、销售，五金机械，通讯设备（不含无线通讯设备），仪器仪表，电脑软件，建筑材料，化工产品（不含危险品及易制毒品），纺织品，日用百货，家用电器，文化用品，健身器械，汽车配件、初级食用农产品的销售，技术咨询服务；经营进出口业务。（依法须经批准的项目，经相关部门批准后方可开展经营活动）,2019-01-10,0579-88276598,,"浙江康恩贝股份有限公司,浙江康恩贝集团股份有限公司",长期,医药制造业,化学药品制剂制造,兰溪市,大健康,2019-09-16 13:28:20,2019-09-16 13:28:20,0,1,金华市,http://gfgs.conbagroup.com/
211,cba550e3-d842-11e9-80c9-fa163e3115c2,9113000023565800XC,130000000018406,23565800X,存续（在营、开业、在册）,120294.558300万人民币,吴相君,制造业,2001-08-28,2001-08-28,,河北省,高新区市场监督管理局,其他股份有限公司(上市),石家庄以岭药业股份有限公司,石家庄市高新技术开发区天山大街２３８号,硬胶囊剂、片剂、颗粒剂、合剂、小容量注射剂、中药配方颗粒的生产；食品用塑料包装容器的生产；保健食品的生产、销售（许可生产品种以食品生产许可品种明细表核准的为准）；饮料（固体饮料类、其他饮料类）的生产、销售(许可生产食品品种以食品生产许可证副页核准的为准)；方便食品的生产、销售（许可生产食品品种以食品生产许可证副页核准的为准）；中药提取物的生产；自营和代理各类商品和技术的进出口，但国家限定公司经营和禁止进出口的商品和技术除外；自有房屋租赁；机械设备租赁；家具、家用电器租赁；农产品收购（不含粮食）；糖果制品的生产、销售（许可生产食品品种以食品生产许可证副页核准的为准）；企业管理咨询服务；健康管理咨询服务（诊疗、医疗、心理咨询除外）。（以下限分支机构经营）；中成药、医药保健品、传统医疗器械、西药、生物制品、卫生辅料的研究、开发；技术咨询、服务、转让。（依法须经批准的项目，经相关部门批准后方可开展经营活动）,2019-05-31,0311-85906122,ylfwb@yiling.cn,,长期,医药制造业,化学药品制剂制造,,大健康,2019-09-16 13:28:21,2019-09-16 13:28:21,0,1,石家庄市,http://www.yilingshop.com/
212,cbe4199f-d842-11e9-80c9-fa163e3115c2,91520400215650676U,522500000001859,215650676,存续（在营、开业、在册）,141120.000000万,姜伟,批发和零售业,1999-03-25,1999-03-25,,贵州省,安顺市工商行政管理局,股份有限公司(上市、自然人投资或控股),贵州百灵企业集团制药股份有限公司,贵州省安顺市经济技术开发区西航路212号,法律、法规、国务院决定规定禁止的不得经营；法律、法规、国务院决定规定应当许可（审批）的，经审批机关批准后凭许可（审批）文件经营;法律、法规、国务院决定规定无需许可（审批）的，市场主体自主选择经营。（片剂、胶囊剂、糖浆剂、软胶囊剂、颗粒剂、丸剂、散剂、喷雾剂、煎膏剂、酊剂、滴丸剂、原料药（岩白菜素）、大容量注射剂（含中药提取）；生产销售预包装食品；卫生用品类生产（皮肤、粘膜卫生用品）；保健食品生产加工（片剂[糖]、颗粒剂、口服液、酒剂）；生产糖果制品（糖果）；中药材种植（国家有专项规定的除外）；市场营销策划；设计、制作、发布、代理国内外各类广告（国家规定须取得专项审批的取得审批后才能从事经营活动）；市场推广宣传；市场调查与研究；文化学术交流、营销管理；化妆品销售（国家有专项规定的除外）；自有仓库及配套设备出租。）,2019-05-23,0851-33411559,1300239037@qq.com,,长期,批发业,矿产品、建材及化工产品批发,,大健康,2019-09-16 13:28:21,2019-09-16 13:28:21,0,1,安顺市,http://gzbl.com
213,cc44c409-d842-11e9-80c9-fa163e3115c2,91120000103100784F,120000000004711,103100784,存续（在营、开业、在册）,76887.307600万人民币,李立群,批发和零售业,1981-12-29,1981-12-29,2050-01-01,天津市,天津市市场和质量监督管理委员会,股份有限公司(上市),天津中新药业集团股份有限公司,天津市南开区白堤路17号,中药材、中成药、中药饮片、西药制剂、化学药品原药制造(3810)化学药品制剂、新草药、医疗器械、营养保健品、化学试剂加工、制造、批发、零售；中药外配加工；卫生用品、健身器材、生活及环境卫生用消毒用品、药物护肤产品、日用百货、服装、鞋帽、家用电器、日用杂品批发、零售；仓储、宣传广告、技术开发、转让、经济信息咨询服务、房屋租赁；计算机及软件、分析仪器的代购、代销、批发、零售；计划生育用品零售；药用设施租赁；经营本企业自产产品及技术的出口业务；经营本企业生产所需的原辅材料、仪器仪表、机械设备、零配件及技术的进口业务（国有限定公司经营和国家禁止进出口的商品及技术除外）；经营进料加工和“三来一补”业务；中药材收购；下列项目由分支机构经营：医疗包装材料、畜用药、饵料添加剂、饲料、饵料、畜禽药品制造、饲料添加剂制造、牲畜饲养、淡水动植物养殖、餐饮、会议服务；定型包装食品、食用油、副食、调料零售；纯净水、卫生用品制造；定型包装饮用水；瓶装纯净水生产经营；饮料；固体饮料；茶饮料生产经营；限分支机构经营：抗生素、生化药品的销售；限分支机构经营：诊疗科目：医学检验科、中医科、内科专业、儿科专业、皮肤科专业、针灸科专业、生物制品、诊断药品、二类精神药品制剂销售；包装印刷；道路运输；酒（黄酒、酒精）糖、茶、饮料品、蜂产品代购、代销；麻醉药品（限罂粟壳）；医疗用毒性药品；蛋白质同化剂；肽类激素的批发；食品、预包装食品、散装食品销售；生物工程及生物制品、化工产品（危险品除外）的研究开发与销售；保健食品批发经营（片剂类、硬胶囊类、袋泡茶类、口服液类）；食用农产品批发、零售；科学研究和技术服务业（依法须经批准的项目，经相关部门批准后方可开展经营活动）,2019-05-21,022-27020598,bgs@zhongxinp.com,,2050-01-01,批发业,医药及医疗器材批发,南开区,大健康,2019-09-16 13:28:22,2019-09-16 13:28:22,0,1,天津市,www.zhongxinp.com
214,ccb6fb02-d842-11e9-80c9-fa163e3115c2,91230300130721906W,230322100000050,130721906,存续（在营、开业、在册）,84916.000000万,方同华,制造业,1996-10-28,1996-10-28,,黑龙江省,鸡西市市场监督管理局,股份有限公司(上市、自然人投资或控股),黑龙江珍宝岛药业股份有限公司,黑龙江省鸡西市虎林市虎林镇红星街72号,冻干粉针剂、口服液、口服溶液剂、合剂、糖浆剂（含中药提取）、小容量注射剂、原料药（穿琥宁、七叶皂苷钠、埃索美拉唑镁、埃索美拉唑钠、盐酸莫西沙星）、无菌原料药、煎膏剂（含中药提取）、浸膏剂、中药提取（仅限分支机构经营）、中药饮片（净制、切制、炮灸（炒、灸法（酒灸、醋灸、盐灸、蜜灸、姜灸）、制炭、煅、蒸、煮、炖、煨）、直接口服饮片)生产；中药材收购、批发、零售；农、林、牧产品收购、批发；普通货物道路运输。,2018-12-19,0467-5854656,zbddsh@zbdzy.com,,长期,医药制造业,中药饮片加工,虎林市,大健康,2019-09-16 13:28:23,2019-09-16 13:28:23,0,1,鸡西市,www.zbdzy.com
215,cd2341d4-d842-11e9-80c9-fa163e3115c2,9122000070222720XH,220000000052632,70222720X,存续（在营、开业、在册）,128075.982600万人民币,郭春林,制造业,1998-05-25,2010-04-29,2058-05-25,吉林省,吉林省市场监督管理厅,股份有限公司(上市、自然人投资或控股),吉林紫鑫药业股份有限公司,吉林省柳河县英利路88号,加工销售中成药，化学药制剂（口服液，片剂，胶囊），药材原料，针织品加工，种养殖业。；设计，制作，代理电视，报纸，灯箱，路牌广告业务；经营本企业自产产品及相关技术的出口业务（国家限定公司经营或禁止出口的商品除外）；经营本企业生产科研所需的原辅材料、机械设备、仪器仪表、零配件及相关技术的进出口业务（国家限定公司经营或禁止进口的商品除外）；经营本企业的进料加工和“三来一补“业务；生产脱脂棉球；土特产品销售；中药饮片、农副产品、中药材的种植与销售。***（依法须经批准的项目，经相关部门批准后方可开展经营活动）。,2019-06-20,0431-88637355,zixin@zxpc.cc,"通化紫金药业有限责任公司,通化紫金药业股份有限公司",2058-05-25,化学原料和化学制品制造业,基础化学原料制造,柳河县,大健康,2019-09-16 13:28:23,2019-09-16 13:28:23,0,1,通化市,http://www.jklinzixin.com.cn
216,cd76ac50-d842-11e9-80c9-fa163e3115c2,9136000070550994XX,360000110002125,70550994X,存续（在营、开业、在册）,123834.007600万人民币,梅强,制造业,1996-12-04,2011-04-01,,江西省,江西省市场监督管理局,其他股份有限公司(上市),仁和药业股份有限公司,江西省南昌市高新开发区京东北大道399号,中药材种植；药材种苗培植；纸箱生产、销售；计算机软件开发；设计、制作、发布、代理国内各类广告；建筑材料、机械设备、五金交电及电子产品、化工产品、金属材料、文体办公用品、百货的批发、零售；技术服务与咨询。（依法须经批准的项目，经相关部门批准后方可开展经营活动）,2015-12-30,0791-83896755,rh000650@126.com,,长期,医药制造业,中成药生产,,大健康,2019-09-16 13:28:24,2019-09-16 13:28:24,0,1,南昌市,www.renheyaoye.com
217,cdca94cc-d842-11e9-80c9-fa163e3115c2,91230199775036754Q,230199100055264,775036754,存续（在营、开业、在册）,58400.000000万人民币,关玉秀,金融业,2005-09-07,2005-09-07,,黑龙江省,哈尔滨市松北区市场监督管理局,其他股份有限公司(上市),葵花药业集团股份有限公司,哈尔滨高新技术产业开发区迎宾路集中区东湖路18号,投资及投资管理；企业策划；医药技术开发。,2019-02-13,87690550,2445400940@qq.com,,长期,其他金融业,其他未列明金融业,,大健康,2019-09-16 13:28:24,2019-09-16 13:28:24,0,1,哈尔滨市,www.kuihuayaoye.com
218,ce1ef960-d842-11e9-80c9-fa163e3115c2,916300007104039124,630000100005561,710403912,存续（在营、开业、在册）,49199.969700万,张斌,制造业,1996-11-25,1996-11-25,,青海省,青海省市场监督管理局,其他股份有限公司(上市),广誉远中药股份有限公司,西宁经济技术开发区金桥路38号,中药原料药、西药原料药、片剂、硬胶囊剂、软胶囊剂、颗粒剂、注射剂、大输液、口服液的生产、销售、研究（仅限取得许可证的分支机构经营）；自营和代理各类商品和技术的进出口，但国家限定公司经营或禁止进出口的商品和技术除外。****,2019-07-31,029-88332288,34112734@qq.com,,长期,医药制造业,中成药生产,,大健康,2019-09-16 13:28:25,2019-09-16 13:28:25,0,1,西宁市,http://www.guangyuyuan.com
219,ce7938ed-d842-11e9-80c9-fa163e3115c2,91450300198888809P,4500001001428,198888809,存续（在营、开业、在册）,59020.000000万,邹节明,制造业,1994-02-23,1994-02-23,,广西壮族自治区,桂林市市场监督管理局,其他股份有限公司(上市),桂林三金药业股份有限公司,桂林市临桂区人民南路9号,片剂、硬胶囊剂、散剂、颗粒剂、酊剂（外用）（毒性中药前处理）、酊剂（内服）、药用辅料、茶剂、丸剂（浓缩丸、水蜜丸、水丸、大蜜丸、小蜜丸、微丸）、煎膏剂、糖浆剂、搽剂、合剂（口服液）、酒剂、喷雾剂、中药前处理和提取、制粒的生产经营；医药科技开发；进出口贸易（国家有专项规定的除外）。,2019-06-06,0773-5843205,yaoye@sanjin.com.cn,,长期,医药制造业,中药饮片加工,临桂区,大健康,2019-09-16 13:28:25,2019-09-16 13:28:25,0,1,桂林市,www.sanjin.com.cn
220,cec902c6-d842-11e9-80c9-fa163e3115c2,91430000712191079B,430000000008755,712191079,存续（在营、开业、在册）,86935.423600万人民币,李振国,制造业,1999-05-12,1999-05-12,,湖南省,湖南省市场监督管理局,其他股份有限公司(上市),九芝堂股份有限公司,长沙市高新区桐梓坡西路339号,生产、销售（限自产）片剂、颗粒剂、丸剂（大蜜丸、小蜜丸、水蜜丸、水丸、浓缩丸）、茶剂（含中药提取）、颗粒剂、煎膏剂、糖浆剂、合剂、灌肠剂、酊剂、胶剂（含中药提取）、酒剂、中药饮片；生产、销售保健品、食品、乳制品、食品添加剂、饮料、日化用品及化妆品；销售一类医疗器械、化学试剂（不含危险品和监控品）；提供制药技术咨询服务、健康咨询服务（不含医疗、诊疗）；医药科技开发；医药产业投资（不得从事吸收存款、集资收款、受托贷款、发行票据、发放贷款等国家金融监管及财政信用业务）；经营商品和技术的进出口业务；产品包装印刷（限分支机构凭有效许可证经营）；货物运输。（依法须经批准的项目，经相关部门批准后方可开展经营活动）,2017-05-17,0731-84499762,hnjzt@jzt.com,,长期,医药制造业,中药饮片加工,,大健康,2019-09-16 13:28:26,2019-09-16 13:28:26,0,1,长沙市,www.hnjzt.com
221,cf250376-d842-11e9-80c9-fa163e3115c2,91420100177701670K,420100000014150,177701670,存续（在营、开业、在册）,43105.389100万元人民币,陈平,制造业,1994-05-09,1994-05-09,2025-01-01,湖北省,武汉市市场监督管理局,股份有限公司(上市),马应龙药业集团股份有限公司,湖北省武汉市武昌南湖周家湾100号,中西药制造；企业经营本企业自产产品及相关技术的出口业务；经营本企业生产、科研所需的原辅材料、机械设备、仪器仪表、零配件及相关技术的进口业务；经营本企业的进料加工和“三来一补”业务；药用包装材料、化妆品、中药制药机械制造、加工、销售；汽车货运；食品（含保健食品）、第一、二类医疗器械、家庭用品、电子产品、日用品、卫生用品、消毒产品的生产及销售。（依法须经审批的项目，经相关部门审批后方可开展经营活动）,2017-07-05,027-87291611,stock@myl1582.com,,2025-01-01,医药制造业,化学药品制剂制造,武昌区,大健康,2019-09-16 13:28:27,2019-09-16 13:28:27,0,1,武汉市,www.mayinglong.cn
222,cf7c4923-d842-11e9-80c9-fa163e3115c2,91220501244575134M,220500000001247,244575134,存续（在营、开业、在册）,96649.470700万人民币,战红君,科学研究和技术服务业,1993-02-26,1993-02-26,,吉林省,通化市工商行政管理局,股份有限公司(上市、自然人投资或控股),通化金马药业集团股份有限公司,吉林省通化市二道江区金马路999号,合剂、颗粒剂、硬胶囊剂、片剂、小容量注射剂、口服溶液剂、糖浆剂、栓剂、丸剂（浓缩丸、糊丸）；中药材的种植、研究；中药饮片、药品、保健品的研发、销售；医疗器械的研究、开发；医疗项目投资；进出口贸易。（依法须经批准的项目，经相关部门批准后方可开展经营活动）。,2019-07-02,0435-3910258,thjmjt@163.com,通化金马药业股份有限公司,长期,研究和试验发展,医学研究和试验发展,二道江区,大健康,2019-09-16 13:28:27,2019-09-16 13:28:27,0,1,通化市,http://www.thjm.cn/
223,cfe1ffa1-d842-11e9-80c9-fa163e3115c2,91360000158307408H,360000110004725,158307408,存续（在营、开业、在册）,42000.000000万人民币,卢小青,制造业,1996-09-18,1996-09-18,,江西省,江西省市场监督管理局,股份有限公司(上市、国有控股),江中药业股份有限公司,江西省南昌市高新区火炬大道788号,硬胶囊剂、原料药（蚓激酶）、糖浆剂、片剂（A线、B线、D线、E线、F线、G线）、颗粒剂、口服液、膏滋剂(含中药前处理及提取）的生产及销售(许可证有效期至2020年12月31日)；糖类、巧克力和糖果（糖果），饮料的生产和销售（凭许可证经营）；保健食品的生产和销售（以上经营项目凭许可证经营）；皮肤粘膜卫生用品（卫生湿巾）的生产销售（卫生许可证的有效期至2018年9月21日）；农副产品收购（粮食收购除外）；国内贸易及生产加工，国际贸易；研发服务、技术转让服务、技术咨询服务。(依法须经批准的项目，经相关部门批准后方可开展经营活动）,2019-01-10,0791-88164183,css@jzjt.com,,长期,医药制造业,中成药生产,,大健康,2019-09-16 13:28:28,2019-09-16 13:28:28,0,1,南昌市,https://shenlingcao.tmall.com
224,d0302806-d842-11e9-80c9-fa163e3115c2,9153010062260401XJ,530100400001412,62260401X,存续（在营、开业、在册）,40050.000000万人民币,樊献俄,制造业,1996-09-16,1996-09-16,,云南省,昆明市工商行政管理局,股份有限公司(台港澳与境内合资、上市),昆明龙津药业股份有限公司,云南省昆明市高新技术开发区科高路2188号,开发、研究、生产、销售中、西医药（依法须经批准的项目，经相关部门批准后方可开展经营活动）,2016-07-26,0871-68520866,kmljyy@vip.sina.com,,长期,医药制造业,化学药品制剂制造,,大健康,2019-09-16 13:28:28,2019-09-16 13:28:28,0,1,昆明市,http://www.longjin.com.cn/
225,7f960417-d850-11e9-80c9-fa163e3115c2,91500102208507353E,20850541-1,208507353,存续(在营、开业、在册),55689.074400万,李阳春,房地产业,1979-11-26,1979-11-26,,重庆市,重庆市涪陵区市场监督管理局,股份有限公司(上市公司),重庆太极实业（集团）股份有限公司,重庆市涪陵区太极大道1号,加工、销售：中成药、西药；以下限分支机构经营：销售副食品及其他食品、汽车二级维护及其以下作业、包装装潢及其他印刷、住宿；保健用品加工、销售；医疗器械销售（仅限I类）；医疗包装制品加工；百货、五金、交电、化工（不含化学危险品）、工艺美术品（不含金银首饰）、机械设备、建筑材料销售(不含危险化学品和木材)销售；机械零部件加工；中草药种植；水产养殖(国家有专项规定的除外)；商品包装；旅游开发；房地产开发（取得相关行政许可后方可执业）；自有房屋、土地出租；贸易经纪与代理［以上范围法律、法规禁止经营的不得经营；法律、法规规定应经审批而未获审批前不得经营］＊＊,2019-07-19,72800072,tjzq@taiji.com,,长期,房地产业,房地产开发经营,涪陵区,大健康,2019-09-16 15:06:26,2019-09-16 15:06:26,0,1,重庆市,
226,d0cf6497-d842-11e9-80c9-fa163e3115c2,91430900MA4L101B51,430900000005212,MA4L101B5,存续（在营、开业、在册）,50320.000000万人民币,刘令安,制造业,1998-01-21,1998-01-21,,湖南省,益阳市市场监督管理局,其他股份有限公司(上市),湖南汉森制药股份有限公司,益阳市银城南路,大容量注射剂、小容量注射剂、片剂、硬胶囊剂、颗粒剂、丸剂（蜜丸、水蜜丸、水丸）、酊剂、煎膏剂、糖浆剂、口服液（含中药提取）（许可证有效期至2020年12月31日止）；生物制品的研发、生产与销售；医疗卫生投资与经营。（依法须经批准的项目，经相关部门批准后方可开展经营活动）,2019-07-08,0737-6351079,furenhui123@126.com,,长期,医药制造业,化学药品制剂制造,,大健康,2019-09-16 13:28:29,2019-09-16 13:28:29,0,1,益阳市,http://www.hanenzy.com/
227,d1200c56-d842-11e9-80c9-fa163e3115c2,91140400729655415C,140421100000376,729655415,存续（在营、开业、在册）,103305.466000万,李安平,制造业,1995-11-15,1995-11-15,2025-11-14,山西省,长治市市场监督管理局,股份有限公司(上市、自然人投资或控股),山西振东制药股份有限公司,山西省长治县光明南路振东科技园,药品生产：原料药（比卡鲁胺、甘草酸二胺、帕米磷酸二钠、美司钠、盐酸法舒地尔、硫酸氢氯吡格雷、羟苯磺酸钙、瑞格列奈、苹果酸阿莫曲坦）、抗肿瘤类原料药（盐酸伊立替康、盐酸托泊替康、盐酸尼莫司汀、盐酸吉西他滨、雷替曲塞、奥沙利铂、依西美坦、卡莫氟、来曲唑、盐酸米托蒽醌、异环磷酰胺、硫酸长春地辛、卡培他滨、达沙替尼、硼替佐米）、小容量注射剂（含抗肿瘤药）、冻干粉针剂（含抗肿瘤药）、片剂（含抗肿瘤药）、硬胶囊剂（含抗肿瘤药）、颗粒剂、散剂、中药提取生产制造。消杀剂系列产品、卫生用品销售；食品经营：保健品（仅限分支机构经营）；新药品开发（仅限研究）；货物进出口；道路货物运输；房屋租赁。（依法须经批准的项目，经相关部门批准后方可开展经营活动）,2019-01-28,0355-8096028,bgs@zdjt.com,,2025-11-14,医药制造业,化学药品原料药制造,长治县,大健康,2019-09-16 13:28:30,2019-09-16 13:28:30,0,1,长治市,www.zdjt.com
228,d178d4e0-d842-11e9-80c9-fa163e3115c2,914100006144026968,410000100020652,614402696,存续（在营、开业、在册）,58644.913800万,熊伟,制造业,1999-04-18,1999-04-18,2020-04-17,河南省,河南省市场监督管理局,其他股份有限公司(上市),河南羚锐制药股份有限公司,河南省新县将军路666号,药品、保健用品、保健食品、消毒用品、医疗器械的生产、销售（凭证）；糖果、调味品、营养食品、食品添加剂的制造、销售；饮料制造、销售；体育用品制造、销售；日用化学产品(不含易燃、易爆危险品)制造、销售；日用杂品制造、销售；新产品、新技术的研究、开发与技术服务；自营本企业自产产品及相关技术的出口业务；自营本企业生产、科研所需的原辅材料、机械设备、仪器仪表、零配件及相关技术的进口业务；进料加工，“三来一补”；信息咨询服务；对房地产、技术贸易、文化教育、广告及宾馆行业的投资。,2019-06-03,0376-2973599,gsbgs@lingrui.com,,2020-04-17,医药制造业,化学药品原料药制造,新县,大健康,2019-09-16 13:28:31,2019-09-16 13:28:31,0,1,信阳市,http://www.lingrui.com
