,uuid,creditCode,regNo,orgCodes,entStatus,regCap,frName,industryPhyName,esDate,opFrom,opTo,regOrgProvince,regOrg,entType,entName,dom,opScope,approvedTime,phoneNumber,email,oldName,validTime,industryLargeName,industryMiddleName,county,industryType,createTime,updateTime,isDeleted,state,city,website
85,6daf71d0-d840-11e9-80c9-fa163e3115c2,91440400192520640G,440400000016680,192520640,在营（开业）企业,12361.300000万,刘杰,制造业,1999-12-30,1999-12-30,,广东省,珠海市工商行政管理局,股份有限公司(上市、自然人投资或控股),珠海润都制药股份有限公司,珠海市金湾区三灶镇机场北路6号,"研发、生产、销售原料药（具体品种详见药品生产许可证）、小容量注射剂、片剂、硬胶囊剂、制剂中间体（微丸）,药用辅料（有效期至2020年12月31日）,医药中间体（不含危险品）。",2019-05-29,,,,长期,医药制造业,化学药品原料药制造,金湾区,大健康,2019-09-16 13:11:24,2019-09-16 13:11:24,0,1,珠海市,www.rdpharma.cn
86,5e007125-4bbd-11e9-a8b1-fa163e5275a2,91510100762295001Q,510122000083030,762295001,存续（在营、开业、在册）,40174.387200万人民币,蒯一希,科学研究和技术服务业,2004-07-15,2004-07-15,3999-01-01,四川省,成都市市场监督管理局,股份有限公司(上市、自然人投资或控股),四川金石东方新材料设备股份有限公司,成都市双流县九江镇万家社区,研发、生产、销售塑料复合管材、管件及设备，真空镀膜设备及其应用技术开发，工业机械，管件模具，施工机具；特种设备的生产、安装、改造、维修；经营本企业自产产品及技术的进出口业务和本企业所需的机械设备、零配件、原辅材料的进出口业务（依法须经批准的项目，经相关部门批准后方可开展经营活动）。,2019-01-02,028-87086858,852740449@qq.com,四川金石东方新材料设备有限公司,长期,专业技术服务业,其他专业技术服务业,双流县,大健康,2019-03-21 17:40:31,2019-03-21 17:40:31,0,0,成都市,http://www.goldstone-group.com/
87,6e1fa0eb-d840-11e9-80c9-fa163e3115c2,91430100722520761D,430181000023195,722520761,存续（在营、开业、在册）,23468.000000万人民币,朱志宏,批发和零售业,2001-01-19,2001-01-19,,湖南省,长沙市市场监督管理局,股份有限公司(上市、自然人投资或控股),湖南九典制药股份有限公司,长沙市浏阳经济技术开发区健康大道1号,药品、二类医疗器械、消毒剂、化工产品、卫生用品、化妆品、保健品、保健食品、食品、特殊医学用途配方食品、特殊膳食食品、一类医疗器械、中医药、生物制品、植物提取物的研发；化学药品制剂、化学药品原料药、生物药品、消毒剂、卫生材料及医药用品、化工产品、食品添加剂、固体饮料的制造；药用辅料、一类医疗器械、二类医疗器械、中药提取物、中成药、生物制品、卫生用品、化妆品、特殊医学用途配方食品、特殊膳食食品、保健食品的生产；药品、医药原料、生物制品、一类医疗器械、二类医疗器械、消毒剂、植物提取物、医药辅料、保健品、化妆品及卫生用品、保健食品、食品、预包装食品、散装食品、特殊医学用途配方食品、特殊膳食食品、食品添加剂、化工产品的销售；中成药、中药饮片的批发；医疗用品及器材的零售；生物技术开发服务、咨询、交流服务、转让服务；中药饮片加工；药用辅料的技术研发、咨询、技术转让；医学研究和试验发展；科技文献服务；科技信息咨询服务；化学工程研究服务；机械设备租赁；房屋租赁；场地租赁；自营和代理各类商品及技术的进出口，但国家限定公司经营或禁止进出口的商品和技术除外。（依法须经批准的项目，经相关部门批准后方可开展经营活动）,2018-05-25,0731-88220220,yly@jiudianph.com,湖南九典制药有限公司,长期,批发业,医药及医疗器材批发,浏阳市,大健康,2019-09-16 13:11:25,2019-09-16 13:11:25,0,1,长沙市,http://www.hnjiudian.com
88,6e7d1710-d840-11e9-80c9-fa163e3115c2,91220501244584110P,220503000000331,244584110,存续（在营、开业、在册）,66601.467400万人民币,孙军,租赁和商务服务业,2000-01-27,2000-01-27,2063-01-27,吉林省,梅河口市市场监督管理局,其他股份有限公司(上市),吉药控股集团股份有限公司,通化市二道江区铁厂镇,控股公司服务；实业投资控股、投资信息咨询（不得从事集资、贷款、理财、吸储等业务）；医药企业受托管理及资产重组；医药技术信息咨询、医药科技成果转让；物流服务；社会经济信息咨询（不含金融、证券、期货投资管理咨询及中介）；企业管理信息咨询；会议服务。（依法须经批准的项目，经相关部门批准后方可开展经营活动）,2019-08-26,0435-6096999,shuanglong@thslhg.com,"吉药控股股份有限公司,通化双龙化工股份有限公司",2063-01-27,商务服务业,企业管理服务,二道江区,大健康,2019-09-16 13:11:25,2019-09-16 13:11:25,0,1,通化市,http://www.thslhg.com/
89,16b88c2a-4bc8-11e9-a8b1-fa163e5275a2,91330600146342118G,330683000017575,146342118,存续,9000.000000万人民币,方南平,制造业,2001-12-30,2001-12-30,9999-09-09,浙江省,浙江省工商行政管理局,其他股份有限公司(上市),浙江昂利康制药股份有限公司,嵊州市嵊州大道北1000号,生产、销售：片剂（含头孢菌素类）、硬胶囊剂（含头孢菌素类）、颗粒剂（头孢菌素类）、冻干粉针剂（青霉素类）、原料药（谷维素、糠甾醇、多索茶碱、头孢拉定、托西酸舒他西林、盐酸班布特罗、维生素E烟酸酯、左氧氟沙星、头孢氨苄、头孢羟氨苄、碘海醇、头孢泊肟酯、替米沙坦、甘草酸二铵、氨甲环酸、苯磺酸左旋氨氯地平、头孢克洛、头孢克肟、头孢呋辛钠、硫酸头孢匹罗、西沙必利、兰索拉唑、尼扎替丁、精氨酸、头孢拉定/L-精氨酸、酮亮氨酸钙、消旋酮异亮氨酸钙、酮苯丙氨酸钙、消旋羟蛋氨酸钙、酮缬氨酸钙）；销售：四甲基胍盐酸盐水溶液、氢氧化纳水溶液；回收特戊酸（水溶液）、回收氨水、回收硫酸铵、回收硫酸铵-氯化铵、回收氯化钠、回收氯化钠-氯化钾；技术开发、技术咨询、技术转让；销售：化工原料（不含危险化学品）；货物进出口。,2018-12-21,83123228,mail@alkpharm.com,"嵊州市昂利康制药有限公司,浙江昂利康制药有限公司",长期,医药制造业,化学药品原料药制造,嵊州市,大健康,2019-03-21 18:57:16,2019-03-21 18:57:16,0,0,绍兴市,http://www.alkpharm.com
90,6f07123c-d840-11e9-80c9-fa163e3115c2,913303007303249630,330322000001788,730324963,存续,11928.000000万人民币,颜贻意,制造业,2001-06-22,2001-06-22,2031-06-21,浙江省,浙江省市场监督管理局,股份有限公司(上市、自然人投资或控股),浙江诚意药业股份有限公司,温州市洞头区化工路118号,硬胶囊剂、小容量注射剂、片剂、颗粒剂、原料药（利巴韦林、硫唑嘌呤、巯嘌呤、阿昔洛韦、克林霉素磷酸酯、维生素K1、维生素K4、亚硫酸氢钠钾萘醌、维生素B4、天麻素、诺氟沙星、托拉塞米、乙酰半胱氨酸、盐酸氨基葡萄糖）生产（在《药品生产许可证》有效期内经营）；医药中间体（不含危险化学品、监控化学品及易制毒品）生产、销售；货物进出口、技术进出口。（依法须经批准的项目，经相关部门批准后方可开展经营活动）,2019-06-04,0577-63489509,shelley@chengyipharma,浙江诚意药业有限公司,2031-06-21,医药制造业,化学药品制剂制造,洞头区,大健康,2019-09-16 13:11:26,2019-09-16 13:11:26,0,1,温州市,http://www.zjcyyy.com/
91,6f62f4dd-d840-11e9-80c9-fa163e3115c2,91330000146644116H,330400000013719,146644116,存续,32259.249900万人民币,陈德康,制造业,2000-07-17,2000-07-17,,浙江省,浙江省市场监督管理局,股份有限公司(上市、自然人投资或控股),浙江莎普爱思药业股份有限公司,浙江省平湖市经济开发区新明路1588号,滴眼剂、大容量注射剂、口服溶液剂、片剂（含头孢菌素类）、硬胶囊剂（含头孢菌素类）、栓剂、颗粒剂（含头孢菌素类）、原料药、冲洗剂、合剂的生产（凭许可证经营），胶囊剂、片剂、颗粒剂类保健食品生产（凭许可证经营），包装装潢、其他印刷品印刷（限浙江莎普爱思药业股份有限公司印刷部经营），从事各类商品及技术的进出口业务，化妆品、日用百货的销售，医疗器械的生产、销售（涉及许可的凭许可证经营），消毒产品的生产（凭许可证经营），消毒产品的销售。（依法须经批准的项目，经相关部门批准后方可开展经营活动）,2019-06-06,0573-85013183,zjspas@zjspas.com,,长期,医药制造业,化学药品制剂制造,平湖市,大健康,2019-09-16 13:11:27,2019-09-16 13:11:27,0,1,嘉兴市,http://www.zjspas.com
92,7167121c-d850-11e9-80c9-fa163e3115c2,916100002941964072,610000100022703,294196407,开业,37327.028500万,吴一坚,批发和零售业,1996-02-14,1996-02-14,,陕西省,陕西省市场监督管理局,股份有限公司(上市),金花企业（集团）股份有限公司,陕西省西安市高新区科技四路202号,金属材料（专控除外）、化工材料(易制毒、监控、危险化学品除外)、化学仪器、电子产品、机械水暖材料、汽车配件、日用百货、办公用品、工艺品、绝缘材料、家具、玻璃陶瓷、计算机、服装针织、装饰材料、园艺产品、玩具、灶具、空气调节设备的批发和零售；与本企业生产经营相关的服务业（许可经营项目除外）；房屋租赁；珠宝加工及批发、零售；本企业生产的药品、机电产品的出口；本企业生产、科研所需的原辅材料、机械设备、仪器仪表及零配件的进口业务（国家限制或禁止公司经营的商品和技术除外）。以下经营范围限分支机构持许可证在有效期内经营：药品、纯净水的生产、加工、销售；化工原料的生产、销售（易制毒、危险、监控化学品除外）。（依法须经批准的项目，经相关部门批准后方可开展经营活动）,2019-05-20,029-88336635,irm@ginwa.com.cn,,长期,零售业,货摊、无店铺及其他零售业,,大健康,2019-09-16 15:06:02,2019-09-16 15:06:02,0,1,西安市,www.ginwa.com.cn
93,7005e01c-d840-11e9-80c9-fa163e3115c2,91460000708873536T,460000000017507,708873536,存续（在营、开业、在册）,45000.000000万,洪江游,制造业,1994-01-20,1994-01-20,,海南省,海南省市场监督管理局,其他股份有限公司(上市),康芝药业股份有限公司,海南省海口国家高新技术产业开发区药谷工业园药谷三路6号,生产销售粉针剂（头孢菌素类）、冻干粉针剂、片剂、胶囊剂、颗粒剂、干混悬剂、散剂；生产加工康芝牌橘红含片、康芝牌春天胶囊；产品研究开发及技术服务；生产退热贴，医疗器械（I类）的销售；医药信息咨询服务。,2017-11-13,68661669,gaocy@honz.com.cn,海南康芝药业股份有限公司,长期,医药制造业,化学药品制剂制造,,大健康,2019-09-16 13:11:28,2019-09-16 13:11:28,0,1,海口市,www.honz.com.cn
94,7057f807-d840-11e9-80c9-fa163e3115c2,91440400737568573N,440400000086623,737568573,在营（开业）企业,16000.000000万,蔡南桂,批发和零售业,2002-04-03,2002-04-03,,广东省,珠海市工商行政管理局,股份有限公司(上市、自然人投资或控股),珠海赛隆药业股份有限公司,珠海市吉大海滨南路47号光大国际贸易中心二层西侧,???????????????????????????????????????????????????????????????药品、食品、营养食品、保健食品、保健品、医疗机械的研发、生产和技术服务；中成药、化学原料药、化学药制剂、抗生素原料药、抗生素制剂、生化药品的批发；预包装食品、食品、保健品、保健食品的销售；化工产品及原料（不含化学危险品）的批发，企业策划；咨询与调查；房屋、机械设备的租赁。(依法须经批准的项目，经相关部门批准后方可开展经营活动)〓,2017-11-23,,,珠海赛隆药业有限公司,长期,批发业,医药及医疗器材批发,,大健康,2019-09-16 13:11:29,2019-09-16 13:11:29,0,1,珠海市,
95,70b1abf5-d840-11e9-80c9-fa163e3115c2,915400917835344626,540000800000113,783534462,存续（在营、开业、在册）,18972.000000万,高帆,批发和零售业,2007-12-29,2007-12-29,,西藏自治区,拉萨经济技术开发区市场监督管理局,其他股份有限公司(上市),西藏易明西雅医药科技股份有限公司,拉萨经济技术开发区林琼岗路6号,销售中药材、中药饮片、中成药、化学药制剂、抗生素制剂、化学原料药（仅限西藏易明西雅医药科技股份有限公司拥有股权或合作开发的产品）、抗生素原料药（仅限用于西藏易明西雅医药科技股份有限公司拥有股权或合作开发及子公司生产使用）（药品经营许可证有限期至2024年02月14日）；批发Ⅲ类；注射穿刺器械；医用核磁共振设备；医用高能射线设备；介入器材；Ⅱ类、Ⅲ类；手术器械；医用电子仪器设备、医用光学器具、仪器及内窥镜设备（除角膜接触镜）、医用超声仪器及有关设备、医用激光仪器设备、医用高频仪器设备、物理治疗及康复设备、医用X射线设备、医用核素设备、临床检验分析仪器、体外循环及血液处理设备、植入材料、手术室、急救室、诊疗室设备及器具医用冷疗、低温、冷藏设备及器具，口腔科材料，医用卫生材料及敷料，医用缝合材料及粘合剂，医用高分子材料及制品。Ⅱ类：医用X射线附属设备及部件，中医器械，医用化验和基础设备器具，口腔科设备及器具，病房护理设备及器具，消毒和灭菌设备及器具（医疗器械经营企业许可证有效期至2024年4月11日）；药材研发及技术成果转让；营销策划；市场调研、推广、开发；健康咨询；房屋租赁；食品的生产、加工及销售；冬虫夏草的收购、加工及销售；土特产品的收购、加工及销售；中药材、藏药材种植。【依法须经批准的项目，经相关部门批准后方可经营该项目】,2019-06-25,0891-6862369,ymky@ymky.com,西藏易明西雅生物医药科技有限公司,长期,零售业,医药及医疗器材专门零售,,大健康,2019-09-16 13:11:29,2019-09-16 13:11:29,0,1,拉萨市,www.emyy.cn
96,7101178e-d840-11e9-80c9-fa163e3115c2,91321000714094280W,320000000006964,714094280,存续（在营、开业、在册）,28545.627000万人民币,夏春来,制造业,2000-02-22,2000-02-22,,江苏省,江苏省扬州工商行政管理局,股份有限公司(上市),江苏联环药业股份有限公司,扬州市文峰路21号,"药品生产（按许可证所列范围生产）。自营和代理各类商品及技术的进出口业务。药品相关技术的授权使用、成果转让、服务咨询。（依法须经批准的项目,经相关部门批准后方可开展经营活动）",2018-08-30,0514-87829701,lh@lhpharma.com,,长期,医药制造业,化学药品原料药制造,,大健康,2019-09-16 13:11:30,2019-09-16 13:11:30,0,1,扬州市,http://www.lhpharma.com/
97,714f6a6c-d840-11e9-80c9-fa163e3115c2,9146000072122491XG,460000400004559,72122491X,存续（在营、开业、在册）,40500.000000万人民币,王成栋,制造业,2000-05-22,2000-05-22,,海南省,海南省市场监督管理局,股份有限公司(中外合资、上市),海南双成药业股份有限公司,海口市秀英区兴国路16号,注射剂、胶囊剂、片剂、颗粒剂、原料药的研究、开发、生产、销售；化工产品(专营除外）、普通机械设备的生产销售；药品研发项目的咨询和转让；自有房屋租赁；转让、出租自有专利、非专利技术及商标。,2016-11-21,68635601,356746996@qq.com,,长期,医药制造业,化学药品制剂制造,秀英区,大健康,2019-09-16 13:11:30,2019-09-16 13:11:30,0,1,海口市,http://www.shuangchengmed.com/
98,71b0167e-d840-11e9-80c9-fa163e3115c2,91140200770127753X,140200400002021,770127753,存续（在营、开业、在册）,20830.800000万人民币,赵群,制造业,2005-03-23,2005-03-23,2035-03-23,山西省,大同市市场监督管理局,股份有限公司(上市、自然人投资或控股),山西仟源医药集团股份有限公司,大同市经济技术开发区湖滨大街53号,生产销售原料药、粉针剂（含青霉素类、头孢菌素类）、片剂（含青霉素类、头孢菌素类）、硬胶囊剂（含青霉素类、头孢菌素类）、颗粒剂（含青霉素类）、散剂、栓剂、精神药品（地西泮片、艾斯唑仑片、硝西泮片、地西泮注射液）（凭有效许可证经营）***生产销售精细化工原料（不含危险化学品、爆炸品）（国家禁止经营专项审批的除外）***,2016-09-21,18636278687,zhanghua@cy-pharm.com,山西仟源制药股份有限公司,2035-03-23,医药制造业,卫生材料及医药用品制造,,大健康,2019-09-16 13:11:31,2019-09-16 13:11:31,0,1,大同市,www.cy-pharm.com
99,721cbfd7-d840-11e9-80c9-fa163e3115c2,91340100723323559X,340100400003589,723323559,存续（在营、开业、在册）,40387.348000万,陶悦群,制造业,2000-10-26,2000-10-26,,安徽省,合肥市高新开发区市场监督管理局,其他股份有限公司(上市),欧普康视科技股份有限公司,合肥市高新区望江西路4899号,三类医用光电仪器类、医用检验类、人工脏器类、二类医用装备类，角膜塑形镜，三类植入体内或长期接触体内的眼科光学器具生产销售，消毒产品、护理产品及眼镜的生产及销售，验光及配镜服务，眼部健康咨询服务，镜片护理及维修；预包装食品与保健食品的销售。（依法须经批准的项目，经相关部门批准后方可开展经营活动）,2019-05-23,0551-62952201,autekchina@126.com,,长期,医药制造业,卫生材料及医药用品制造,,大健康,2019-09-16 13:11:32,2019-09-16 13:11:32,0,1,合肥市,http：//www.orthok.cn
100,7277d00f-d840-11e9-80c9-fa163e3115c2,91370000744521618L,370000400004566,744521618,在营（开业）企业,96403.108600万人民币,刘文静,制造业,2002-12-02,2002-12-02,,山东省,山东省市场监督管理局,股份有限公司(台港澳与境内合资、上市),蓝帆医疗股份有限公司,山东省淄博市齐鲁化学工业区清田路21号,生产加工PVC手套、丁腈手套及其他塑料制品、粒料，销售本公司生产的产品。丁腈手套、乳胶手套、纸浆模塑制品、一类、二类医疗器械产品的批发业务。(依法须经批准的项目，经相关部门批准后方可开展经营活动，有效期以许可证为准),2019-05-27,0533-7871017,1270252242@qq.com,山东蓝帆塑胶股份有限公司,长期,橡胶和塑料制品业,塑料制品业,齐鲁化学工业区,大健康,2019-09-16 13:11:32,2019-09-16 13:11:32,0,1,淄博市,http://blueail.tmall.com/index.htm?pm=a1z10.5.w5002-3572873782.2.z8PLL3
101,ac6cd39f-4bbf-11e9-a8b1-fa163e5275a2,91440300743219767A,440301103617854,743219767,存续（在营、开业、在册）,40001.000000万人民币,陈志强,信息传输、软件和信息技术服务业,2002-09-27,2002-09-27,,广东省,南山局,其他股份有限公司(上市),深圳开立生物医疗科技股份有限公司,深圳市南山区粤海街道麻岭社区高新中区科技中2路1号深圳软件园(2期)12栋201、202,医疗器械的软件开发（不含国家限制项目）；生物技术开发、技术转让、技术服务、技术咨询；自产产品技术维护服务；自产产品售后服务；经营进出口业务（法律、行政法规、国务院决定禁止的项目除外，限制的项目须取得许可后方可经营）。生产经营医疗器械及其配套试剂及产品软件开发；生产经营显示器产品及电子产品。,2019-01-03,0755-26722890,liusf@sonoscape.net,深圳市开立科技有限公司,长期,软件和信息技术服务业,信息系统集成服务,南山区,大健康,2019-03-21 17:57:02,2019-03-21 17:57:02,0,0,深圳市,http://www.sonoscape.com.cn
102,72dd089e-d840-11e9-80c9-fa163e3115c2,9111000063379674X4,110000005102777,63379674X,开业,54081.619900万人民币,谢宇峰,科学研究和技术服务业,1997-05-12,1997-05-12,2047-05-11,北京市,北京市工商行政管理局朝阳分局,其他股份有限公司(上市),北京万东医疗科技股份有限公司,北京市朝阳区酒仙桥东路9号院3号楼,技术咨询、技术服务；货物进出口；技术进出口；代理进出口；机器设备安装、维修；劳务服务；销售汽车（不含九座以下乘用车）、I、II类医疗器械；物业管理；出租商业用房；出租办公用房；医疗器械制造；销售III类医疗器械。（企业依法自主选择经营项目，开展经营活动；销售III类医疗器械以及依法须经批准的项目，经相关部门批准后依批准的内容开展经营活动；不得从事本市产业政策禁止和限制类项目的经营活动。）,2019-06-18,010-84569688,wdyL055@263.net.cn,"北京万东医疗装备股份有限公司,华润万东医疗装备股份有限公司",2047-05-11,科技推广和应用服务业,技术推广服务,朝阳区,大健康,2019-09-16 13:11:33,2019-09-16 13:11:33,0,1,北京市,www.wandong.com.cn
103,7331885a-d840-11e9-80c9-fa163e3115c2,91370000168611868Q,370000018078729,168611868,在营（开业）企业,59496.774700万人民币,扈永刚,制造业,1993-11-08,1993-11-08,,山东省,山东省市场监督管理局,其他股份有限公司(上市),山东省药用玻璃股份有限公司,淄博市沂源县城,许可证范围内医疗器械生产、销售；汽车货运；包装装潢印刷品印刷；药品包装材料和容器注册证范围内的药品包装材料和容器的生产、销售（凭注册证书经营）；成品油零售（限分支机构经营）；(以上项目有效期限以许可证为准)；日用玻璃制品的生产、销售；纸箱加工、销售；玻璃生产专用设备的制造、销售；玻璃包装容器的生产、加工、销售；备案范围内的进出口业务。(依法须经批准的项目，经相关部门批准后方可开展经营活动)。,2019-06-24,0533-3259029,rub149@pharmglass.com,,长期,非金属矿物制品业,玻璃制品制造,沂源县,大健康,2019-09-16 13:11:33,2019-09-16 13:11:33,0,1,淄博市,http://www.pharmglass.com/
104,7389710b-d840-11e9-80c9-fa163e3115c2,91500109203249834P,500109000014539,203249834,存续(在营、开业、在册),15120.000000万,邓勇,制造业,1989-10-27,1989-10-27,,重庆市,重庆市北碚区市场监督管理局,股份有限公司(上市公司),重庆正川医药包装材料股份有限公司,重庆市北碚区龙凤桥街道正川玻璃工业园,制造、加工、销售：锁口瓶，药用玻璃瓶，瓶盖，塑料制品，玻璃仪器及制品，医药包装技术服务；货物进出口。[经营范围中属于法律、行政法规禁止的不得经营；法律、行政法规规定须经批准的项目，应当依法经过批准后方可经营]**,2018-05-31,023-68349817,zccw@cqzcjt.com,,长期,非金属矿物制品业,玻璃制品制造,北碚区,大健康,2019-09-16 13:11:34,2019-09-16 13:11:34,0,1,重庆市,www.cqzcjt.com
105,08ca6046-4bbd-11e9-a8b1-fa163e5275a2,91310000770943355B,310117002570397,770943355,存续（在营、开业、在册）,10436.32万人民币,林武辉,制造业,2005-01-18,2005-01-18,,上海市,上海市工商行政管理局,股份有限公司（上市、自然人投资或控股）,上海海顺新型药用包装材料股份有限公司,上海市松江区洞泾镇蔡家浜路18号,新型药用包装材料、儿童保护包装材料、高阻隔涂布材料、耐蒸煮复合材料、高阻隔复合材料、特种薄膜材料的生产和销售，包装装潢印刷，货物及技术的进出口业务。【依法须经批准的项目，经相关部门批准后方可开展经营活动】,2005-01-18,021-57675717,weivlin@126.com,,长期,印刷和记录媒介复制业,印刷,松江区,大健康,2019-03-21 17:38:08,2019-03-21 17:38:08,0,0,上海市,www.haishunpackaging.com
