,uuid,creditCode,regNo,orgCodes,entStatus,regCap,frName,industryPhyName,esDate,opFrom,opTo,regOrgProvince,regOrg,entType,entName,dom,opScope,approvedTime,phoneNumber,email,oldName,validTime,industryLargeName,industryMiddleName,county,industryType,createTime,updateTime,isDeleted,state,city,website
145,819f44ba-d840-11e9-80c9-fa163e3115c2,9111030210221806X9,110106002952913,10221806X,开业,11499.460000万人民币,冯宇霞,科学研究和技术服务业,1998-02-25,1998-02-25,,北京市,北京市工商行政管理局北京经济技术开发区分局,股份有限公司(上市、自然人投资或控股),北京昭衍新药研究中心股份有限公司,北京市北京经济技术开发区荣京东街甲5号,食品、日用化学产品、化学试剂、生物制品、生物技术的技术开发、技术转让、技术咨询、技术服务、技术培训；货物进出口、技术进出口、代理进出口；技术检测。（企业依法自主选择经营项目，开展经营活动；依法须经批准的项目，经相关部门批准后依批准的内容开展经营活动；不得从事本市产业政策禁止和限制类项目的经营活动。）,2019-02-12,67869966,info@joinnlabortories.com,北京昭衍新药研究中心有限公司,长期,科技推广和应用服务业,其他科技推广和应用服务业,,大健康,2019-09-16 13:11:58,2019-09-16 13:11:58,0,1,,http://www.joinn-lab.com/about/beijing.html
146,1a77716a-4bbd-11e9-a8b1-fa163e5275a2,915000007748965415,500221000006854,774896541,存续(在营、开业、在册),54274.753300万人民币,居年丰,制造业,2005-07-07,2005-07-07,,重庆市,重庆市工商行政管理局,股份有限公司(中外合资、上市),重庆博腾制药科技股份有限公司,重庆市（长寿）化工园区精细化工一区,原料药生产（按药品生产许可证核定事项和期限从事经营）；创新药品的技术开发、技术服务；化学原料药研究开发（含中小规模试剂）、技术转让、技术服务；医药中间体、精细化学品的生产、销售(不含危险化学品、易制毒化学品等许可经营项目）；采用生物工程技术的新型药物研发、生产（须取得相关行政许可或审批后方可从事经营）；生物工程与生物医学工程技术开发、技术转让、技术服务；化学药品制剂制造（须取得相关行政许可或审批后方可从事经营）；药品销售（须取得相关行政许可或审批后方可从事经营）；货物进出口、技术进出口。『依法禁止经营的不得经营；依法应经许可审批而未获许可批准前不得经营』★★,2018-10-24,023-86083200,qin.han@porton.cn,,长期,化学原料和化学制品制造业,合成材料制造,精细化工一区,大健康,2019-03-21 17:38:38,2019-03-21 17:38:38,0,0,,http://cn.porton.cn/
147,77ce007e-d850-11e9-80c9-fa163e3115c2,9144070072115339X0,440700400013622,72115339X,在营（开业）企业,49977.689200万人民币,曾宪经,制造业,2000-01-26,2000-01-26,,广东省,江门市工商行政管理局,其他股份有限公司(上市),量子高科（中国）生物股份有限公司,江门市高新区高新西路133号,保健食品(国内保健食品批准证书范围内产品)的研发、生产、销售及技术转让；低聚果糖、低聚半乳糖、母乳低聚糖、医疗器械、诊断试剂、调味料(固态、液态)、饮料、蜂产品、茶叶及相关制品、糖果制品、其他食品等预包装食品、新食品原料、特殊膳食食品、特殊医学用途配方食品、食品添加剂及酶制剂、医药辅料、饲料添加剂的研发、生产、销售；医药研发服务；医药技术研发、技术咨询和技术转让；生物技术的开发和转让；研发、销售包装材料；健康管理服务（不含医疗服务）、咨询、生物健康技术开发；经营本企业生产、科研所需的原辅材料、产品、仪器仪表、机械设备、零配件及相关技术的进出口业务；批发、零售：预包装食品、乳制品、保健食品、化妆品、日用品、保健仪器、检测仪器、理疗仪器；资产租赁。（以上经营范围涉及前置审批的项目凭相关许可证核准的经营范围经营，未取得前置许可证的不得经营。上述经营范围不涉及国营贸易管理商品，涉及配额、许可证管理商品的，按国家有关规定办理申请）。(依法须经批准的项目，经相关部门批准后方可开展经营活动)〓,2018-10-30,0750-8258999,kf@qht.cc,,长期,食品制造业,其他食品制造,,大健康,2019-09-16 15:06:13,2019-09-16 15:06:13,0,1,江门市,http://www.qht.cc/
148,827426b3-d840-11e9-80c9-fa163e3115c2,91110228754175237Y,110228006107984,754175237,开业,16000.000000万人民币,刘建华,制造业,2003-09-03,2011-09-02,,北京市,北京市工商行政管理局密云分局,股份有限公司(台港澳与境内合资、上市),北京康辰药业股份有限公司,北京市密云区经济开发区兴盛南路11号,生产冻干粉针剂、原料药；生物医药开发研究；技术转让；咨询服务（不含中介服务）。（该企业于2011年09月02日由内资企业变更为外商投资企业。依法须经批准的项目，经相关部门批准后依批准的内容开展经营活动。）,2018-11-08,82898888,无,北京康辰药业有限公司,长期,医药制造业,化学药品制剂制造,密云区,大健康,2019-09-16 13:11:59,2019-09-16 13:11:59,0,1,,http://www.konruns.cn
149,82ca782e-d840-11e9-80c9-fa163e3115c2,91330000146008822C,330000000006107,146008822,存续,53649.445600万人民币,陈尧根,制造业,2001-12-31,2001-12-31,,浙江省,浙江省市场监督管理局,其他股份有限公司(上市),浙江亚太药业股份有限公司,浙江省绍兴市柯桥区云集路1152号,片剂（含青霉素类）、硬胶囊剂（含头孢菌素类、青霉素类）、透皮贴剂（激素类）、冻干粉针剂、粉针剂（头孢菌素类）的生产（详见《中华人民共和国药品生产许可证》），原料药的生产（详见《中华人民共和国药品生产许可证》）。经营进出口业务，医药相关产业项目的研究、投资与管理。,2017-10-19,0575-84815739,,,长期,医药制造业,卫生材料及医药用品制造,,大健康,2019-09-16 13:12:00,2019-09-16 13:12:00,0,1,绍兴市,http://www.ytyaoye.com
150,831b9c41-d840-11e9-80c9-fa163e3115c2,91440101743555883K,440106000113076,743555883,在营（开业）企业,13391.750000万人民币,王廷春,科学研究和技术服务业,2002-09-29,2002-09-29,,广东省,广州市工商行政管理局,股份有限公司,广州博济医药生物技术股份有限公司,广州市天河区华观路1933号701房,药品研发;医学研究和试验发展;生物技术推广服务;生物技术开发服务;信息技术咨询服务;科技信息咨询服务;科技项目评估服务;生物技术咨询、交流服务;生物技术转让服务;科技中介服务;科技成果鉴定服务;技术进出口;专利服务;商标代理等服务;化学试剂和助剂制造（监控化学品、危险化学品除外）;药物检测仪器制造;非许可类医疗器械经营;化学试剂和助剂销售（监控化学品、危险化学品除外）;商品批发贸易（许可审批类商品除外）;医疗用品及器材零售（不含药品及医疗器械）;商品零售贸易（许可审批类商品除外）;医疗设备租赁服务;机械设备租赁;房屋租赁;办公设备租赁服务;场地租赁（不含仓储）;,2018-08-23,020-38473208,gzboji@gzboji.com,,长期,研究和试验发展,医学研究和试验发展,天河区,大健康,2019-09-16 13:12:00,2019-09-16 13:12:00,0,1,广州市,www.gzboji.com
151,837f0899-d840-11e9-80c9-fa163e3115c2,916500007129676234,650000040000152,712967623,开业,40038.639400万,郑彩红,信息传输、软件和信息技术服务业,1996-06-21,1996-06-21,,新疆维吾尔自治区,五家渠工商行政管理局,其他股份有限公司(上市),新疆百花村股份有限公司,新疆五家渠十六区青湖南路1025号新华苑小区综合楼B段-11,一般货物与技术的进出口经营；边境小额贸易；能源投资销售；矿产品、建材及化工产品、机械设备、五金产品及电子产品、农、牧产品、食品饮料及烟草制品、纺织、服装及家庭用品销售；贸易经纪与代理；仓储业；租赁业；体育；商业服务；软件和信息技术服务业；其他批发业；综合零售；市场开发建设；广告经营；汽车租赁。,2019-03-11,09912356607,无,,长期,软件和信息技术服务业,软件开发,,大健康,2019-09-16 13:12:01,2019-09-16 13:12:01,0,1,,www.xjbhc.net
152,8415a6a2-d840-11e9-80c9-fa163e3115c2,912205012445783007,220500000013331,244578300,存续（在营、开业、在册）,203398.851700万人民币,冷春生,制造业,1992-12-28,1992-12-28,,吉林省,通化市工商行政管理局,其他股份有限公司(上市),通化东宝药业股份有限公司,通化县东宝新村,硬胶囊剂、片剂（含激素类）、颗粒剂、小容量注射剂、原料药（重组人胰岛素）、生物工程产品（重组人胰岛素注射剂），II类：6854手术室、急救室、诊疗设备及器具、II类6815注射穿刺器械；III类：6815注射穿刺器械;II类：6840临床检验分析仪器及诊断试剂（含诊断试剂）；6841医用化验和基础设备器具。（依法须经批准的项目，经相关部门批准后方可开展经营活动）,2019-03-08,04355088008,thdbcw@163.com,中国通化东宝实业股份有限公司,长期,医药制造业,化学药品制剂制造,通化县,大健康,2019-09-16 13:12:02,2019-09-16 13:12:02,0,1,通化市,http://www.thdb.com
153,846a4b0c-d840-11e9-80c9-fa163e3115c2,91440300279544901A,440301102761269,279544901,存续（在营、开业、在册）,124720.170400万人民币,李锂,制造业,1998-04-21,1998-04-21,,广东省,深圳市市场监督管理局,股份有限公司(上市),深圳市海普瑞药业集团股份有限公司,深圳市南山区松坪山郎山路21号,一般经营项目是：开发、生产经营原料药（肝素钠、依诺肝素钠），从事货物及技术进出口（不含分销及国家专营、专控、专卖商品）。，许可经营项目是：,2019-08-01,0755-26980200,sizheng@hepalink.com,"深圳市海普瑞实业发展有限公司,深圳市海普瑞生物技术有限公司,深圳市海普瑞药业有限公司,深圳市海普瑞药业股份有限公司",长期,医药制造业,化学药品原料药制造,南山区,大健康,2019-09-16 13:12:02,2019-09-16 13:12:02,0,1,深圳市,http://www.hepalink.com
154,84bd1591-d840-11e9-80c9-fa163e3115c2,914404006174883094,440400400032571,617488309,在营（开业）企业,55314.127100万人民币,朱保国,制造业,1985-01-26,1985-01-26,,广东省,珠海市工商行政管理局,股份有限公司(台港澳与境内合资、上市),丽珠医药集团股份有限公司,珠海市金湾区创业北路38号总部大楼,生产和销售自产的中西药原料、医药中间体、中药材、中药饮片医疗器械、卫生材料、保健品、药用化妆品、中西成药、生化试剂，兼营化工、食品、信息业务，医药原料药。本企业自产产品及相关技术的进出口业务；批发中成药、化学原料药及其制剂、抗生素原料药及其制剂、生物制品（预防性生物制品除外）、生化药品。（涉及配额许可证、国家有专项规定的商品应按有关规定办理；需其他行政许可项目，取得许可后方可经营）。,2019-07-24,,,,长期,医药制造业,化学药品制剂制造,金湾区,大健康,2019-09-16 13:12:03,2019-09-16 13:12:03,0,1,珠海市,
155,85187b13-d840-11e9-80c9-fa163e3115c2,91320100726054999R,320191000010753,726054999,存续（在营、开业、在册）,55242.590000万人民币,唐咏群,制造业,2000-10-16,2000-10-16,,江苏省,南京市市场监督管理局,股份有限公司(台港澳与境内合资、上市),南京健友生化制药股份有限公司,南京高新开发区MA010-1号地,药品生产（按许可证所列范围经营）；销售自产产品。药品的研发及其技术成果转让、技术咨询和服务。从事与本企业生产同类产品的批发、佣金代理（拍卖除外）和技术的进出口业务（不涉及国营贸易管理商品，涉及配额、许可证管理商品的，按国家有关规定办理申请）；自有房屋租赁。（涉及许可证经营的凭许可证经营）。（依法须经批准的项目，经相关部门批准后方可开展经营活动）,2018-06-06,025-86990815,sales@nkf-pharma.com.cn,,长期,医药制造业,化学药品原料药制造,,大健康,2019-09-16 13:12:03,2019-09-16 13:12:03,0,1,南京市,www.nkf-pharma.com
156,8584596a-d840-11e9-80c9-fa163e3115c2,91330000147968817N,330000000027652,147968817,存续,125098.839800万人民币,陈保华,制造业,2001-02-28,2001-02-28,,浙江省,浙江省工商行政管理局,其他股份有限公司(上市),浙江华海药业股份有限公司,浙江省临海市汛桥,药品的生产（范围详见《中华人民共和国药品生产许可证》）。医药中间体制造，经营进出口业务。,2018-07-05,85010288,yaoxiaofeng@huahaipharm.com,,长期,医药制造业,化学药品原料药制造,临海市,大健康,2019-09-16 13:12:04,2019-09-16 13:12:04,0,1,台州市,http://www.huahaipharm.com/
157,85dcaa67-d840-11e9-80c9-fa163e3115c2,913300002646284831,370200018046069,264628483,存续,117852.349200万人民币,祝方猛,金融业,1997-05-06,1997-05-06,,浙江省,浙江省市场监督管理局,股份有限公司(上市、自然人投资或控股),普洛药业股份有限公司,浙江省东阳市横店江南路399号,医药行业投资，网络投资，股权投资管理，生物制药技术的研究、开发、转让，国内贸易；经营进出口业务。,2019-04-16,0579-86557820,000739@apeloa.com,,长期,资本市场服务,资本投资服务,东阳市,大健康,2019-09-16 13:12:05,2019-09-16 13:12:05,0,1,金华市,http://www.apeloa.com
158,9f0e8cc7-4bbd-11e9-a8b1-fa163e5275a2,913300001482332737,330000000004437,148233273,存续,161882.025300万人民币,杨思卫,制造业,1998-05-07,1998-05-07,,浙江省,浙江省工商行政管理局,其他股份有限公司(上市),浙江海翔药业股份有限公司,浙江省台州市椒江区外沙支路100号,药品的生产（范围详见《中华人民共和国药品生产许可证》）。化工原料及产品的生产，经营进出口业务。,2018-07-06,0756-89088166,stock@hisoar.com,浙江海翔医药化工股份有限公司,长期,化学原料和化学制品制造业,基础化学原料制造,椒江区,大健康,2019-03-21 17:42:20,2019-03-21 17:42:20,0,0,台州市,http://www.hisoar.com/
159,864d9e65-d840-11e9-80c9-fa163e3115c2,91370000705877283D,370600400006926,705877283,在营（开业）企业,80221.432600万,由守谊,制造业,1998-12-31,1998-12-31,,山东省,烟台市市场监督管理局,其他股份有限公司(上市),烟台东诚药业集团股份有限公司,烟台经济技术开发区长白山路7号,原料药（肝素钠、肝素钙、硫酸软骨素钠、硫酸软骨素钠（供注射用）、那屈肝素钙、依诺肝素钠、达肝素钠）的生产、加工和销售；硫酸软骨素、胶原蛋白、透明质酸、细胞色素C（冻干）、鲨鱼骨粉、盐酸氨基葡萄糖的生产、加工和销售；货物及技术进出口；医药技术和产品的研发及成果转让、相关技术咨询及服务。(依法须经批准的项目，经相关部门批准后方可开展经营活动，有效期以许可证为准),2019-08-05,0535-6391521,dcadd@dcb-group.com,烟台东诚生化股份有限公司,长期,医药制造业,生物药品制造,,大健康,2019-09-16 13:12:05,2019-09-16 13:12:05,0,1,烟台市,http://www.dcb-group.com/
160,86aa7ce8-d840-11e9-80c9-fa163e3115c2,91330000704676703E,330000000014592,704676703,存续,80588.917100万人民币,花莉蓉,制造业,1998-07-13,1998-07-13,,浙江省,浙江省工商行政管理局,其他股份有限公司(上市),浙江九洲药业股份有限公司,浙江省台州市椒江区外沙工业区,化学原料药、医药中间体、医药制剂的研发、生产（凭许可证经营），创新药品、生物技术的技术开发、技术服务，新药、医药中间体及原料药的研发、销售（凭许可证经营），化工原料（不含危险化学品及易制毒品）、机械设备的制造、销售，经营进出口业务。（依法须经批准的项目，经相关部门批准后方可开展经营活动）,2019-01-30,0576-88820712,jiuzhou@jiuzhoupharma.com,,长期,医药制造业,化学药品原料药制造,椒江区,大健康,2019-09-16 13:12:06,2019-09-16 13:12:06,0,1,台州市,http://www.jiuzhoupharma.com
161,86fc661f-d840-11e9-80c9-fa163e3115c2,91370000164238285E,370300018517205,164238285,在营（开业）企业,39315.223800万人民币,赵叶青,租赁和商务服务业,2004-01-12,2004-01-12,2024-01-12,山东省,淄博市市场监督管理局,股份有限公司(上市),山东金城医药集团股份有限公司,山东省淄博市淄川经济开发区双山路1号,基础化学原料、化学药品原料药、化学药品制剂、生物药品、中药饮片、中成药、保健品、医疗仪器设备及器械的研发、生产、销售和技术咨询；企业管理服务；从事对未上市企业的股权投资、对上市公司非公开发行股票的投资及相关咨询服务（未经金融监管部门批准，不得从事吸收存款、融资担保、代客理财等金融业务）；货物、技术进出口。(依法须经批准的项目，经相关部门批准后方可开展经营活动),2019-03-28,05335414988,jinchengyiyao@126.com,"山东金城医药化工股份有限公司,山东金城医药股份有限公司",2024-01-12,商务服务业,企业管理服务,淄川区,大健康,2019-09-16 13:12:07,2019-09-16 13:12:07,0,1,淄博市,http://www.jinchengpharm.com/
162,049e1942-4bc8-11e9-a8b1-fa163e5275a2,91331000148144211K,331003000003258,148144211,存续,18199.312400万人民币,屠勇军,制造业,2003-02-14,2003-02-14,9999-09-09,浙江省,浙江省工商行政管理局,其他股份有限公司(上市),浙江天宇药业股份有限公司,台州市黄岩江口化工开发区,"年回收：乙酸乙酯631吨、四氢呋喃509吨、环己烷+异丙醇1135吨、甲苯5.3吨、N,N-二甲基甲酰胺（DMF）7.3吨、乙醇17.6吨、乙腈1.3吨、丙酮1.5吨、甲醇4.3吨、二氯甲烷3.3吨（凭有效许可证经营），药品生产（范围详见《药品生产许可证》，凭有效许可证经营），N,N-二环己基碳酰亚胺、坎地沙坦、4甲基-2-氰基联苯、4溴甲基-2-氰基联苯、沙坦主环、联苯乙酸、依普沙坦制造，货物与技术的进出口。",2019-01-15,,,"浙江天宇医药化工有限公司,浙江天宇药业有限公司,浙江黄岩天宇化工厂",长期,化学原料和化学制品制造业,基础化学原料制造,黄岩区,大健康,2019-03-21 18:56:45,2019-03-21 18:56:45,0,0,台州市,http://www.tianyupharm.com/
163,798b68cb-d850-11e9-80c9-fa163e3115c2,91500000759253791C,500221000008591,759253791,存续(在营、开业、在册),118971.238200万,汪天祥,制造业,2004-02-25,2004-02-25,,重庆市,重庆市工商行政管理局,股份有限公司(上市公司),福安药业（集团）股份有限公司,重庆市长寿区化南一路1号,生产、销售（限本企业自产产品）无菌原料药、非无菌原料药（以上经营范围按相关许可证核定事项及期限从事经营），研究、开发精细化工产品、专用化学品（不含危险化学品），生产、销售化工产品（不含危险化学品），技术转让，货物进出口，企业管理咨询服务。（依法须经批准的项目，经相关部门批准后方可开展经营活动）,2017-05-16,023-61213011,fapharm@fapharm.com,,长期,医药制造业,化学药品原料药制造,长寿区,大健康,2019-09-16 15:06:15,2019-09-16 15:06:15,0,1,重庆市,www.fapharm.com
164,87d362aa-d840-11e9-80c9-fa163e3115c2,91330000719525000X,331000000000876,719525000,存续,82009.382700万人民币,王莺妹,制造业,1999-10-11,1999-10-11,,浙江省,浙江省工商行政管理局,股份有限公司(上市、自然人投资或控股),浙江永太科技股份有限公司,浙江省化学原料药基地临海园区东海第五大道1号,农药（不含危险化学品）的销售（凭许可证经营）。有机中间体（不含危险化学品和易制毒化学品）、机械设备制造和销售，生物技术、农药技术、化学品技术开发、技术咨询、技术服务，仪器仪表、化工产品（不含危险化学品和易制毒化学品）、矿产品（除专控）、石油制品（不含成品油及危险化学品）、电子产品原料及产品的销售，从事进出口业务。,2018-06-07,0576-85588222,hr@yongtaitech.com,,长期,化学原料和化学制品制造业,基础化学原料制造,,大健康,2019-09-16 13:12:08,2019-09-16 13:12:08,0,1,,
165,8824e142-d840-11e9-80c9-fa163e3115c2,91130100787019708G,130100000144986,787019708,存续（在营、开业、在册）,20000.000000万人民币,韩峰,制造业,2006-04-05,2006-04-05,,河北省,石家庄市市场监督管理局,其他股份有限公司(上市),石药集团新诺威制药股份有限公司,石家庄市栾城区富强西路36号,原料药（咖啡因、茶碱、氨茶碱、二羟丙茶碱、可可碱、已酮可可碱、多索茶碱）、精神药品（咖啡因）的生产销售；食品添加剂（咖啡因）的生产销售；医药中间体的销售；饮料生产、销售；保健食品、糖果制品生产销售；预包装食品批发零售；预包装食品、保健食品（以上不含冷冻食品）技术研发、技术转让、技术咨询、技术推广服务；经营本企业自产产品和技术的出口业务和本企业生产、科研所需的原辅材料、机械设备、仪器仪表、零配件及相关技术的进口业务，但国家限定公司经营和禁止进口的商品及技术除外。（法律、法规及国务院决定禁止或者限制的事项，不得经营；需其它部门审批的事项，待批准后，方可经营）,2019-06-10,0311-85408926,xinnuowei@mail.ecspc.com,,长期,医药制造业,中成药生产,栾城县,大健康,2019-09-16 13:12:08,2019-09-16 13:12:08,0,1,石家庄市,http://www.xnwpharma.net/
166,8878e633-d840-11e9-80c9-fa163e3115c2,9135000070536404XU,350000100021905,70536404X,存续（在营、开业、在册）,263383.629000万人民币,邓海雄,租赁和商务服务业,2002-09-28,2002-09-28,2052-09-27,福建省,福建省市场监督管理局,股份有限公司(上市、自然人投资或控股),冠福控股股份有限公司,德化县浔中镇土坂村,对医疗业，制造业，采矿业，能源业，建筑业，批发和零售业，交通运输、仓储和邮政业，住宿和餐饮业，房地产业，租赁和商务服务业，信息传输、软件和信息技术服务业，科学研究和技术服务业，居民服务业，教育业，文化、体育和娱乐业的投资；仓储服务（不含危险品）；物业管理；房屋租赁；对外贸易；企业管理咨询服务；会议及展览服务；日用品、体育用品、建筑材料、化工产品（不含危险化学品和易制毒化学品）、五金交电、金属材料、电子产品、针纺织品的销售；计算机技术、医疗、医药技术的研发。（依法须经批准的项目，经相关部门批准后方可开展经营活动）,2019-03-07,0595-23519999,无,福建冠福现代家用股份有限公司,2052-09-27,商务服务业,企业管理服务,德化县,大健康,2019-09-16 13:12:09,2019-09-16 13:12:09,0,1,泉州市,http://guanfujj.tmall.com/shop/view_shop.htm?spm=a230r.1.14.5.2Fejnc&user_number_id=856488924
167,88cd88de-d840-11e9-80c9-fa163e3115c2,9141080074921334XW,410822100001782,74921334X,存续（在营、开业、在册）,21793.602500万,方华生,科学研究和技术服务业,2003-03-13,2003-03-13,,河南省,焦作市市场监督管理局,股份有限公司(上市、自然人投资或控股),博爱新开源医疗科技集团股份有限公司,河南省焦作市博爱县文化路（东段）1888号,研发、生产：药用辅料、原料药（聚维酮碘）、粘合剂、食品添加剂（不溶性聚乙烯聚吡咯烷酮）；聚乙烯吡咯烷酮系列产品、乙烯基甲醚/马来酸酐聚合物（工业级，按照许可证核定的有效期限经营）；医疗技术开发、转让、咨询、服务。Ⅰ、Ⅱ、Ⅲ类医疗器械；Ⅰ、Ⅱ、Ⅲ类诊断试剂的销售；生物技术的研发、技术服务、技术转让、技术咨询。经营本企业自产产品及技术的出口业务和本企业所需的机械设备、零配件、原辅材料及技术的进口业务，但国家限定公司经营或禁止进出口的商品及技术除外**（涉及许可经营项目，应取得相关部门许可后方可经营）,2019-01-28,0391-8694499,nature1111@sina.com,博爱新开源制药股份有限公司,长期,科技推广和应用服务业,技术推广服务,博爱县,大健康,2019-09-16 13:12:10,2019-09-16 13:12:10,0,1,焦作市,http://www.china-pvp.com
